{
  "students": {
    "stu_001": {
      "name": "Abigail Khan",
      "email": "abigail.khan1@university.edu",
      "studentId": "ID-2024001",
      "coins": 34,
      "walletBalance": 70,
      "profileImage": "https://ui-avatars.com/api/?name=Abigail+Khan&background=random&color=fff"
    },
    "stu_002": {
      "name": "Tom Connor",
      "email": "tom.connor2@university.edu",
      "studentId": "ID-2024002",
      "coins": 20,
      "walletBalance": 56,
      "profileImage": "https://ui-avatars.com/api/?name=Tom+Connor&background=random&color=fff"
    },
    "stu_003": {
      "name": "James Anderson",
      "email": "james.anderson3@university.edu",
      "studentId": "ID-2024003",
      "coins": 34,
      "walletBalance": 93,
      "profileImage": "https://ui-avatars.com/api/?name=James+Anderson&background=random&color=fff"
    },
    "stu_004": {
      "name": "Tom Walker",
      "email": "tom.walker4@university.edu",
      "studentId": "ID-2024004",
      "coins": 49,
      "walletBalance": 68,
      "profileImage": "https://ui-avatars.com/api/?name=Tom+Walker&background=random&color=fff"
    },
    "stu_005": {
      "name": "Chen Day",
      "email": "chen.day5@university.edu",
      "studentId": "ID-2024005",
      "coins": 40,
      "walletBalance": 9,
      "profileImage": "https://ui-avatars.com/api/?name=Chen+Day&background=random&color=fff"
    },
    "stu_006": {
      "name": "Charles Ross",
      "email": "charles.ross6@university.edu",
      "studentId": "ID-2024006",
      "coins": 30,
      "walletBalance": 85,
      "profileImage": "https://ui-avatars.com/api/?name=Charles+Ross&background=random&color=fff"
    },
    "stu_007": {
      "name": "Isabella Taylor",
      "email": "isabella.taylor7@university.edu",
      "studentId": "ID-2024007",
      "coins": 42,
      "walletBalance": 41,
      "profileImage": "https://ui-avatars.com/api/?name=Isabella+Taylor&background=random&color=fff"
    },
    "stu_008": {
      "name": "Isabella Rodriguez",
      "email": "isabella.rodriguez8@university.edu",
      "studentId": "ID-2024008",
      "coins": 17,
      "walletBalance": 23,
      "profileImage": "https://ui-avatars.com/api/?name=Isabella+Rodriguez&background=random&color=fff"
    },
    "stu_009": {
      "name": "Daniel White",
      "email": "daniel.white9@university.edu",
      "studentId": "ID-2024009",
      "coins": 11,
      "walletBalance": 69,
      "profileImage": "https://ui-avatars.com/api/?name=Daniel+White&background=random&color=fff"
    },
    "stu_010": {
      "name": "Isabella Smith",
      "email": "isabella.smith10@university.edu",
      "studentId": "ID-2024010",
      "coins": 32,
      "walletBalance": 71,
      "profileImage": "https://ui-avatars.com/api/?name=Isabella+Smith&background=random&color=fff"
    },
    "stu_011": {
      "name": "Evelyn Smith",
      "email": "evelyn.smith11@university.edu",
      "studentId": "ID-2024011",
      "coins": 47,
      "walletBalance": 39,
      "profileImage": "https://ui-avatars.com/api/?name=Evelyn+Smith&background=random&color=fff"
    },
    "stu_012": {
      "name": "David Taylor",
      "email": "david.taylor12@university.edu",
      "studentId": "ID-2024012",
      "coins": 15,
      "walletBalance": 1,
      "profileImage": "https://ui-avatars.com/api/?name=David+Taylor&background=random&color=fff"
    },
    "stu_013": {
      "name": "James Connor",
      "email": "james.connor13@university.edu",
      "studentId": "ID-2024013",
      "coins": 32,
      "walletBalance": 83,
      "profileImage": "https://ui-avatars.com/api/?name=James+Connor&background=random&color=fff"
    },
    "stu_014": {
      "name": "Robert Harris",
      "email": "robert.harris14@university.edu",
      "studentId": "ID-2024014",
      "coins": 33,
      "walletBalance": 65,
      "profileImage": "https://ui-avatars.com/api/?name=Robert+Harris&background=random&color=fff"
    },
    "stu_015": {
      "name": "Thomas Day",
      "email": "thomas.day15@university.edu",
      "studentId": "ID-2024015",
      "coins": 36,
      "walletBalance": 27,
      "profileImage": "https://ui-avatars.com/api/?name=Thomas+Day&background=random&color=fff"
    },
    "stu_016": {
      "name": "Alex White",
      "email": "alex.white16@university.edu",
      "studentId": "ID-2024016",
      "coins": 43,
      "walletBalance": 9,
      "profileImage": "https://ui-avatars.com/api/?name=Alex+White&background=random&color=fff"
    },
    "stu_017": {
      "name": "Sophia Garcia",
      "email": "sophia.garcia17@university.edu",
      "studentId": "ID-2024017",
      "coins": 36,
      "walletBalance": 77,
      "profileImage": "https://ui-avatars.com/api/?name=Sophia+Garcia&background=random&color=fff"
    },
    "stu_018": {
      "name": "Evelyn Clark",
      "email": "evelyn.clark18@university.edu",
      "studentId": "ID-2024018",
      "coins": 12,
      "walletBalance": 56,
      "profileImage": "https://ui-avatars.com/api/?name=Evelyn+Clark&background=random&color=fff"
    },
    "stu_019": {
      "name": "David Wilson",
      "email": "david.wilson19@university.edu",
      "studentId": "ID-2024019",
      "coins": 7,
      "walletBalance": 69,
      "profileImage": "https://ui-avatars.com/api/?name=David+Wilson&background=random&color=fff"
    },
    "stu_020": {
      "name": "Jessica Walker",
      "email": "jessica.walker20@university.edu",
      "studentId": "ID-2024020",
      "coins": 23,
      "walletBalance": 50,
      "profileImage": "https://ui-avatars.com/api/?name=Jessica+Walker&background=random&color=fff"
    },
    "stu_021": {
      "name": "William Lewis",
      "email": "william.lewis21@university.edu",
      "studentId": "ID-2024021",
      "coins": 2,
      "walletBalance": 20,
      "profileImage": "https://ui-avatars.com/api/?name=William+Lewis&background=random&color=fff"
    },
    "stu_022": {
      "name": "Mike Martinez",
      "email": "mike.martinez22@university.edu",
      "studentId": "ID-2024022",
      "coins": 25,
      "walletBalance": 98,
      "profileImage": "https://ui-avatars.com/api/?name=Mike+Martinez&background=random&color=fff"
    },
    "stu_023": {
      "name": "Jessica Jackson",
      "email": "jessica.jackson23@university.edu",
      "studentId": "ID-2024023",
      "coins": 13,
      "walletBalance": 100,
      "profileImage": "https://ui-avatars.com/api/?name=Jessica+Jackson&background=random&color=fff"
    },
    "stu_024": {
      "name": "Abigail Rodriguez",
      "email": "abigail.rodriguez24@university.edu",
      "studentId": "ID-2024024",
      "coins": 48,
      "walletBalance": 61,
      "profileImage": "https://ui-avatars.com/api/?name=Abigail+Rodriguez&background=random&color=fff"
    },
    "stu_025": {
      "name": "Emily Taylor",
      "email": "emily.taylor25@university.edu",
      "studentId": "ID-2024025",
      "coins": 48,
      "walletBalance": 2,
      "profileImage": "https://ui-avatars.com/api/?name=Emily+Taylor&background=random&color=fff"
    },
    "stu_026": {
      "name": "James Rodriguez",
      "email": "james.rodriguez26@university.edu",
      "studentId": "ID-2024026",
      "coins": 14,
      "walletBalance": 47,
      "profileImage": "https://ui-avatars.com/api/?name=James+Rodriguez&background=random&color=fff"
    },
    "stu_027": {
      "name": "Robert Smith",
      "email": "robert.smith27@university.edu",
      "studentId": "ID-2024027",
      "coins": 7,
      "walletBalance": 34,
      "profileImage": "https://ui-avatars.com/api/?name=Robert+Smith&background=random&color=fff"
    },
    "stu_028": {
      "name": "Jessica Thompson",
      "email": "jessica.thompson28@university.edu",
      "studentId": "ID-2024028",
      "coins": 31,
      "walletBalance": 36,
      "profileImage": "https://ui-avatars.com/api/?name=Jessica+Thompson&background=random&color=fff"
    },
    "stu_029": {
      "name": "Rahul Sharma",
      "email": "rahul.sharma29@university.edu",
      "studentId": "ID-2024029",
      "coins": 33,
      "walletBalance": 30,
      "profileImage": "https://ui-avatars.com/api/?name=Rahul+Sharma&background=random&color=fff"
    },
    "stu_030": {
      "name": "Isabella Smith",
      "email": "isabella.smith30@university.edu",
      "studentId": "ID-2024030",
      "coins": 21,
      "walletBalance": 42,
      "profileImage": "https://ui-avatars.com/api/?name=Isabella+Smith&background=random&color=fff"
    }
  },
  "vendors": {
    "vendor_1": {
      "username": "vendor_1",
      "password": "password123",
      "storeName": "City Mart 1",
      "plan": "Premium",
      "joinedAt": "2025-12-01T08:05:33.535Z"
    },
    "vendor_2": {
      "username": "vendor_2",
      "password": "password123",
      "storeName": "Quick Bistro 2",
      "plan": "Premium",
      "joinedAt": "2025-12-05T18:31:00.609Z"
    },
    "vendor_3": {
      "username": "vendor_3",
      "password": "password123",
      "storeName": "Daily Hub 3",
      "plan": "Premium",
      "joinedAt": "2025-12-12T06:45:57.399Z"
    },
    "vendor_4": {
      "username": "vendor_4",
      "password": "password123",
      "storeName": "Campus Corner 4",
      "plan": "Premium",
      "joinedAt": "2025-12-25T21:43:10.227Z"
    },
    "vendor_5": {
      "username": "vendor_5",
      "password": "password123",
      "storeName": "Fast Corner 5",
      "plan": "Premium",
      "joinedAt": "2025-12-09T05:20:16.128Z"
    },
    "vendor_6": {
      "username": "vendor_6",
      "password": "password123",
      "storeName": "Quick Hub 6",
      "plan": "Premium",
      "joinedAt": "2025-12-26T17:24:36.218Z"
    },
    "vendor_7": {
      "username": "vendor_7",
      "password": "password123",
      "storeName": "Tech Station 7",
      "plan": "Premium",
      "joinedAt": "2025-12-04T20:20:06.060Z"
    },
    "vendor_8": {
      "username": "vendor_8",
      "password": "password123",
      "storeName": "Super Mart 8",
      "plan": "Premium",
      "joinedAt": "2025-12-08T13:47:26.219Z"
    },
    "vendor_9": {
      "username": "vendor_9",
      "password": "password123",
      "storeName": "City Point 9",
      "plan": "Premium",
      "joinedAt": "2025-12-22T03:52:23.094Z"
    },
    "vendor_10": {
      "username": "vendor_10",
      "password": "password123",
      "storeName": "Super Station 10",
      "plan": "Premium",
      "joinedAt": "2025-12-04T05:23:24.320Z"
    },
    "vendor_11": {
      "username": "vendor_11",
      "password": "password123",
      "storeName": "Uni Store 11",
      "plan": "Premium",
      "joinedAt": "2025-12-03T13:15:50.256Z"
    },
    "vendor_12": {
      "username": "vendor_12",
      "password": "password123",
      "storeName": "City Cafe 12",
      "plan": "Premium",
      "joinedAt": "2025-12-14T00:00:50.306Z"
    },
    "vendor_13": {
      "username": "vendor_13",
      "password": "password123",
      "storeName": "Daily Station 13",
      "plan": "Premium",
      "joinedAt": "2025-12-25T23:24:31.099Z"
    },
    "vendor_14": {
      "username": "vendor_14",
      "password": "password123",
      "storeName": "Tech Store 14",
      "plan": "Premium",
      "joinedAt": "2025-12-12T11:50:38.024Z"
    },
    "vendor_15": {
      "username": "vendor_15",
      "password": "password123",
      "storeName": "Fresh Hub 15",
      "plan": "Premium",
      "joinedAt": "2025-12-27T18:32:31.746Z"
    },
    "vendor_16": {
      "username": "vendor_16",
      "password": "password123",
      "storeName": "Fresh Station 16",
      "plan": "Premium",
      "joinedAt": "2025-12-21T23:51:09.349Z"
    },
    "vendor_17": {
      "username": "vendor_17",
      "password": "password123",
      "storeName": "Tech Point 17",
      "plan": "Premium",
      "joinedAt": "2025-12-11T18:12:10.651Z"
    },
    "vendor_18": {
      "username": "vendor_18",
      "password": "password123",
      "storeName": "Fresh Store 18",
      "plan": "Premium",
      "joinedAt": "2025-12-13T04:09:45.197Z"
    },
    "vendor_19": {
      "username": "vendor_19",
      "password": "password123",
      "storeName": "Fresh Bistro 19",
      "plan": "Premium",
      "joinedAt": "2025-12-23T13:56:25.724Z"
    },
    "vendor_20": {
      "username": "vendor_20",
      "password": "password123",
      "storeName": "Super Corner 20",
      "plan": "Premium",
      "joinedAt": "2025-12-17T15:39:01.744Z"
    },
    "vendor_21": {
      "username": "vendor_21",
      "password": "password123",
      "storeName": "Campus Station 21",
      "plan": "Premium",
      "joinedAt": "2025-12-29T00:19:49.844Z"
    },
    "vendor_22": {
      "username": "vendor_22",
      "password": "password123",
      "storeName": "Uni Hub 22",
      "plan": "Premium",
      "joinedAt": "2025-12-08T10:05:26.840Z"
    },
    "vendor_23": {
      "username": "vendor_23",
      "password": "password123",
      "storeName": "Tech Store 23",
      "plan": "Premium",
      "joinedAt": "2025-12-24T04:58:38.913Z"
    },
    "vendor_24": {
      "username": "vendor_24",
      "password": "password123",
      "storeName": "Super Mart 24",
      "plan": "Premium",
      "joinedAt": "2025-12-15T03:11:38.253Z"
    },
    "vendor_25": {
      "username": "vendor_25",
      "password": "password123",
      "storeName": "Fresh Cafe 25",
      "plan": "Premium",
      "joinedAt": "2025-12-14T12:52:09.132Z"
    },
    "vendor_26": {
      "username": "vendor_26",
      "password": "password123",
      "storeName": "Tech Station 26",
      "plan": "Premium",
      "joinedAt": "2025-12-13T07:43:00.724Z"
    },
    "vendor_27": {
      "username": "vendor_27",
      "password": "password123",
      "storeName": "Campus Cafe 27",
      "plan": "Premium",
      "joinedAt": "2025-12-29T02:39:06.010Z"
    },
    "vendor_28": {
      "username": "vendor_28",
      "password": "password123",
      "storeName": "Daily Cafe 28",
      "plan": "Premium",
      "joinedAt": "2025-12-17T23:22:34.612Z"
    },
    "vendor_29": {
      "username": "vendor_29",
      "password": "password123",
      "storeName": "Quick Corner 29",
      "plan": "Premium",
      "joinedAt": "2025-12-04T00:51:04.975Z"
    },
    "vendor_30": {
      "username": "vendor_30",
      "password": "password123",
      "storeName": "Fresh Store 30",
      "plan": "Premium",
      "joinedAt": "2025-12-09T11:39:47.507Z"
    },
    "vendor_31": {
      "username": "vendor_31",
      "password": "password123",
      "storeName": "Fresh Spot 31",
      "plan": "Premium",
      "joinedAt": "2025-12-23T11:04:24.358Z"
    },
    "vendor_32": {
      "username": "vendor_32",
      "password": "password123",
      "storeName": "Quick Hub 32",
      "plan": "Premium",
      "joinedAt": "2025-12-26T21:50:37.078Z"
    },
    "vendor_33": {
      "username": "vendor_33",
      "password": "password123",
      "storeName": "Fast Cafe 33",
      "plan": "Premium",
      "joinedAt": "2025-12-06T09:15:19.234Z"
    },
    "vendor_34": {
      "username": "vendor_34",
      "password": "password123",
      "storeName": "Tech Cafe 34",
      "plan": "Premium",
      "joinedAt": "2025-12-05T15:18:48.300Z"
    },
    "vendor_35": {
      "username": "vendor_35",
      "password": "password123",
      "storeName": "City Spot 35",
      "plan": "Premium",
      "joinedAt": "2025-12-18T20:06:42.749Z"
    },
    "vendor_36": {
      "username": "vendor_36",
      "password": "password123",
      "storeName": "Fast Bistro 36",
      "plan": "Premium",
      "joinedAt": "2025-12-23T12:38:58.600Z"
    },
    "vendor_37": {
      "username": "vendor_37",
      "password": "password123",
      "storeName": "Fresh Spot 37",
      "plan": "Premium",
      "joinedAt": "2025-11-29T15:27:19.589Z"
    },
    "vendor_38": {
      "username": "vendor_38",
      "password": "password123",
      "storeName": "Fast Hub 38",
      "plan": "Premium",
      "joinedAt": "2025-12-06T07:48:39.843Z"
    },
    "vendor_39": {
      "username": "vendor_39",
      "password": "password123",
      "storeName": "Fast Zone 39",
      "plan": "Premium",
      "joinedAt": "2025-12-03T08:45:09.727Z"
    },
    "vendor_40": {
      "username": "vendor_40",
      "password": "password123",
      "storeName": "Uni Hub 40",
      "plan": "Premium",
      "joinedAt": "2025-12-22T00:35:11.189Z"
    },
    "vendor_41": {
      "username": "vendor_41",
      "password": "password123",
      "storeName": "Tech Store 41",
      "plan": "Premium",
      "joinedAt": "2025-12-29T18:48:20.752Z"
    },
    "vendor_42": {
      "username": "vendor_42",
      "password": "password123",
      "storeName": "Fresh Mart 42",
      "plan": "Premium",
      "joinedAt": "2025-12-16T12:08:38.813Z"
    },
    "vendor_43": {
      "username": "vendor_43",
      "password": "password123",
      "storeName": "Fresh Cafe 43",
      "plan": "Premium",
      "joinedAt": "2025-12-11T16:05:39.758Z"
    },
    "vendor_44": {
      "username": "vendor_44",
      "password": "password123",
      "storeName": "Super Cafe 44",
      "plan": "Premium",
      "joinedAt": "2025-12-02T11:31:14.634Z"
    },
    "vendor_45": {
      "username": "vendor_45",
      "password": "password123",
      "storeName": "Student Store 45",
      "plan": "Premium",
      "joinedAt": "2025-12-06T22:25:10.991Z"
    },
    "vendor_46": {
      "username": "vendor_46",
      "password": "password123",
      "storeName": "City Bistro 46",
      "plan": "Premium",
      "joinedAt": "2025-12-03T00:24:36.983Z"
    },
    "vendor_47": {
      "username": "vendor_47",
      "password": "password123",
      "storeName": "Uni Corner 47",
      "plan": "Premium",
      "joinedAt": "2025-12-29T22:39:59.829Z"
    },
    "vendor_48": {
      "username": "vendor_48",
      "password": "password123",
      "storeName": "Uni Point 48",
      "plan": "Premium",
      "joinedAt": "2025-12-12T03:38:44.050Z"
    },
    "vendor_49": {
      "username": "vendor_49",
      "password": "password123",
      "storeName": "Student Bistro 49",
      "plan": "Premium",
      "joinedAt": "2025-12-09T02:44:42.687Z"
    },
    "vendor_50": {
      "username": "vendor_50",
      "password": "password123",
      "storeName": "Quick Zone 50",
      "plan": "Premium",
      "joinedAt": "2025-12-28T21:13:47.660Z"
    }
  },
  "shops": {
    "city_mart_1": {
      "shopId": "city_mart_1",
      "shopName": "City Mart 1",
      "ownerName": "Owner 1",
      "vendorUsername": "vendor_1",
      "category": "Retail",
      "description": "The best retail spot on campus. Serving students since 2020.",
      "specialty": "Student Specials",
      "services": "Walk-in, Pre-order",
      "address": "Building 5, Shop 1",
      "status": "Open",
      "shopImage": "https://picsum.photos/seed/city_mart_1/800/400",
      "products": [
        {
          "name": "Basic Item",
          "price": "50"
        },
        {
          "name": "Premium Item",
          "price": "150"
        },
        {
          "name": "Student Combo",
          "price": "100"
        }
      ],
      "createdAt": "2025-12-18T23:33:41.313Z"
    },
    "quick_bistro_2": {
      "shopId": "quick_bistro_2",
      "shopName": "Quick Bistro 2",
      "ownerName": "Owner 2",
      "vendorUsername": "vendor_2",
      "category": "Stationery",
      "description": "The best stationery spot on campus. Serving students since 2020.",
      "specialty": "Student Specials",
      "services": "Walk-in, Pre-order",
      "address": "Building 9, Shop 2",
      "status": "Open",
      "shopImage": "https://picsum.photos/seed/quick_bistro_2/800/400",
      "products": [
        {
          "name": "Basic Item",
          "price": "50"
        },
        {
          "name": "Premium Item",
          "price": "150"
        },
        {
          "name": "Student Combo",
          "price": "100"
        }
      ],
      "createdAt": "2025-12-21T09:51:43.286Z"
    },
    "daily_hub_3": {
      "shopId": "daily_hub_3",
      "shopName": "Daily Hub 3",
      "ownerName": "Owner 3",
      "vendorUsername": "vendor_3",
      "category": "Retail",
      "description": "The best retail spot on campus. Serving students since 2020.",
      "specialty": "Student Specials",
      "services": "Walk-in, Pre-order",
      "address": "Building 1, Shop 3",
      "status": "Open",
      "shopImage": "https://picsum.photos/seed/daily_hub_3/800/400",
      "products": [
        {
          "name": "Basic Item",
          "price": "50"
        },
        {
          "name": "Premium Item",
          "price": "150"
        },
        {
          "name": "Student Combo",
          "price": "100"
        }
      ],
      "createdAt": "2025-12-29T14:29:54.586Z"
    },
    "campus_corner_4": {
      "shopId": "campus_corner_4",
      "shopName": "Campus Corner 4",
      "ownerName": "Owner 4",
      "vendorUsername": "vendor_4",
      "category": "Stationery",
      "description": "The best stationery spot on campus. Serving students since 2020.",
      "specialty": "Student Specials",
      "services": "Walk-in, Pre-order",
      "address": "Building 1, Shop 4",
      "status": "Open",
      "shopImage": "https://picsum.photos/seed/campus_corner_4/800/400",
      "products": [
        {
          "name": "Basic Item",
          "price": "50"
        },
        {
          "name": "Premium Item",
          "price": "150"
        },
        {
          "name": "Student Combo",
          "price": "100"
        }
      ],
      "createdAt": "2025-12-11T09:16:12.011Z"
    },
    "fast_corner_5": {
      "shopId": "fast_corner_5",
      "shopName": "Fast Corner 5",
      "ownerName": "Owner 5",
      "vendorUsername": "vendor_5",
      "category": "Stationery",
      "description": "The best stationery spot on campus. Serving students since 2020.",
      "specialty": "Student Specials",
      "services": "Walk-in, Pre-order",
      "address": "Building 6, Shop 5",
      "status": "Open",
      "shopImage": "https://picsum.photos/seed/fast_corner_5/800/400",
      "products": [
        {
          "name": "Basic Item",
          "price": "50"
        },
        {
          "name": "Premium Item",
          "price": "150"
        },
        {
          "name": "Student Combo",
          "price": "100"
        }
      ],
      "createdAt": "2025-12-01T14:36:39.219Z"
    },
    "quick_hub_6": {
      "shopId": "quick_hub_6",
      "shopName": "Quick Hub 6",
      "ownerName": "Owner 6",
      "vendorUsername": "vendor_6",
      "category": "Retail",
      "description": "The best retail spot on campus. Serving students since 2020.",
      "specialty": "Student Specials",
      "services": "Walk-in, Pre-order",
      "address": "Building 6, Shop 6",
      "status": "Open",
      "shopImage": "https://picsum.photos/seed/quick_hub_6/800/400",
      "products": [
        {
          "name": "Basic Item",
          "price": "50"
        },
        {
          "name": "Premium Item",
          "price": "150"
        },
        {
          "name": "Student Combo",
          "price": "100"
        }
      ],
      "createdAt": "2025-12-25T08:42:41.433Z"
    },
    "tech_station_7": {
      "shopId": "tech_station_7",
      "shopName": "Tech Station 7",
      "ownerName": "Owner 7",
      "vendorUsername": "vendor_7",
      "category": "Food",
      "description": "The best food spot on campus. Serving students since 2020.",
      "specialty": "Student Specials",
      "services": "Walk-in, Pre-order",
      "address": "Building 1, Shop 7",
      "status": "Open",
      "shopImage": "https://picsum.photos/seed/tech_station_7/800/400",
      "products": [
        {
          "name": "Basic Item",
          "price": "50"
        },
        {
          "name": "Premium Item",
          "price": "150"
        },
        {
          "name": "Student Combo",
          "price": "100"
        }
      ],
      "createdAt": "2025-12-03T17:47:17.637Z"
    },
    "super_mart_8": {
      "shopId": "super_mart_8",
      "shopName": "Super Mart 8",
      "ownerName": "Owner 8",
      "vendorUsername": "vendor_8",
      "category": "Stationery",
      "description": "The best stationery spot on campus. Serving students since 2020.",
      "specialty": "Student Specials",
      "services": "Walk-in, Pre-order",
      "address": "Building 6, Shop 8",
      "status": "Open",
      "shopImage": "https://picsum.photos/seed/super_mart_8/800/400",
      "products": [
        {
          "name": "Basic Item",
          "price": "50"
        },
        {
          "name": "Premium Item",
          "price": "150"
        },
        {
          "name": "Student Combo",
          "price": "100"
        }
      ],
      "createdAt": "2025-12-02T05:05:03.551Z"
    },
    "city_point_9": {
      "shopId": "city_point_9",
      "shopName": "City Point 9",
      "ownerName": "Owner 9",
      "vendorUsername": "vendor_9",
      "category": "Retail",
      "description": "The best retail spot on campus. Serving students since 2020.",
      "specialty": "Student Specials",
      "services": "Walk-in, Pre-order",
      "address": "Building 10, Shop 9",
      "status": "Open",
      "shopImage": "https://picsum.photos/seed/city_point_9/800/400",
      "products": [
        {
          "name": "Basic Item",
          "price": "50"
        },
        {
          "name": "Premium Item",
          "price": "150"
        },
        {
          "name": "Student Combo",
          "price": "100"
        }
      ],
      "createdAt": "2025-12-01T06:55:58.447Z"
    },
    "super_station_10": {
      "shopId": "super_station_10",
      "shopName": "Super Station 10",
      "ownerName": "Owner 10",
      "vendorUsername": "vendor_10",
      "category": "Stationery",
      "description": "The best stationery spot on campus. Serving students since 2020.",
      "specialty": "Student Specials",
      "services": "Walk-in, Pre-order",
      "address": "Building 8, Shop 10",
      "status": "Open",
      "shopImage": "https://picsum.photos/seed/super_station_10/800/400",
      "products": [
        {
          "name": "Basic Item",
          "price": "50"
        },
        {
          "name": "Premium Item",
          "price": "150"
        },
        {
          "name": "Student Combo",
          "price": "100"
        }
      ],
      "createdAt": "2025-12-04T02:31:18.662Z"
    },
    "uni_store_11": {
      "shopId": "uni_store_11",
      "shopName": "Uni Store 11",
      "ownerName": "Owner 11",
      "vendorUsername": "vendor_11",
      "category": "Retail",
      "description": "The best retail spot on campus. Serving students since 2020.",
      "specialty": "Student Specials",
      "services": "Walk-in, Pre-order",
      "address": "Building 8, Shop 11",
      "status": "Open",
      "shopImage": "https://picsum.photos/seed/uni_store_11/800/400",
      "products": [
        {
          "name": "Basic Item",
          "price": "50"
        },
        {
          "name": "Premium Item",
          "price": "150"
        },
        {
          "name": "Student Combo",
          "price": "100"
        }
      ],
      "createdAt": "2025-12-18T14:24:19.555Z"
    },
    "city_cafe_12": {
      "shopId": "city_cafe_12",
      "shopName": "City Cafe 12",
      "ownerName": "Owner 12",
      "vendorUsername": "vendor_12",
      "category": "Services",
      "description": "The best services spot on campus. Serving students since 2020.",
      "specialty": "Student Specials",
      "services": "Walk-in, Pre-order",
      "address": "Building 7, Shop 12",
      "status": "Open",
      "shopImage": "https://picsum.photos/seed/city_cafe_12/800/400",
      "products": [
        {
          "name": "Basic Item",
          "price": "50"
        },
        {
          "name": "Premium Item",
          "price": "150"
        },
        {
          "name": "Student Combo",
          "price": "100"
        }
      ],
      "createdAt": "2025-12-09T17:56:39.703Z"
    },
    "daily_station_13": {
      "shopId": "daily_station_13",
      "shopName": "Daily Station 13",
      "ownerName": "Owner 13",
      "vendorUsername": "vendor_13",
      "category": "Services",
      "description": "The best services spot on campus. Serving students since 2020.",
      "specialty": "Student Specials",
      "services": "Walk-in, Pre-order",
      "address": "Building 3, Shop 13",
      "status": "Open",
      "shopImage": "https://picsum.photos/seed/daily_station_13/800/400",
      "products": [
        {
          "name": "Basic Item",
          "price": "50"
        },
        {
          "name": "Premium Item",
          "price": "150"
        },
        {
          "name": "Student Combo",
          "price": "100"
        }
      ],
      "createdAt": "2025-12-15T18:17:45.496Z"
    },
    "tech_store_14": {
      "shopId": "tech_store_14",
      "shopName": "Tech Store 14",
      "ownerName": "Owner 14",
      "vendorUsername": "vendor_14",
      "category": "Services",
      "description": "The best services spot on campus. Serving students since 2020.",
      "specialty": "Student Specials",
      "services": "Walk-in, Pre-order",
      "address": "Building 8, Shop 14",
      "status": "Open",
      "shopImage": "https://picsum.photos/seed/tech_store_14/800/400",
      "products": [
        {
          "name": "Basic Item",
          "price": "50"
        },
        {
          "name": "Premium Item",
          "price": "150"
        },
        {
          "name": "Student Combo",
          "price": "100"
        }
      ],
      "createdAt": "2025-12-19T16:28:50.742Z"
    },
    "fresh_hub_15": {
      "shopId": "fresh_hub_15",
      "shopName": "Fresh Hub 15",
      "ownerName": "Owner 15",
      "vendorUsername": "vendor_15",
      "category": "Services",
      "description": "The best services spot on campus. Serving students since 2020.",
      "specialty": "Student Specials",
      "services": "Walk-in, Pre-order",
      "address": "Building 1, Shop 15",
      "status": "Open",
      "shopImage": "https://picsum.photos/seed/fresh_hub_15/800/400",
      "products": [
        {
          "name": "Basic Item",
          "price": "50"
        },
        {
          "name": "Premium Item",
          "price": "150"
        },
        {
          "name": "Student Combo",
          "price": "100"
        }
      ],
      "createdAt": "2025-11-29T19:34:22.841Z"
    },
    "fresh_station_16": {
      "shopId": "fresh_station_16",
      "shopName": "Fresh Station 16",
      "ownerName": "Owner 16",
      "vendorUsername": "vendor_16",
      "category": "Services",
      "description": "The best services spot on campus. Serving students since 2020.",
      "specialty": "Student Specials",
      "services": "Walk-in, Pre-order",
      "address": "Building 8, Shop 16",
      "status": "Open",
      "shopImage": "https://picsum.photos/seed/fresh_station_16/800/400",
      "products": [
        {
          "name": "Basic Item",
          "price": "50"
        },
        {
          "name": "Premium Item",
          "price": "150"
        },
        {
          "name": "Student Combo",
          "price": "100"
        }
      ],
      "createdAt": "2025-12-22T13:17:33.101Z"
    },
    "tech_point_17": {
      "shopId": "tech_point_17",
      "shopName": "Tech Point 17",
      "ownerName": "Owner 17",
      "vendorUsername": "vendor_17",
      "category": "Services",
      "description": "The best services spot on campus. Serving students since 2020.",
      "specialty": "Student Specials",
      "services": "Walk-in, Pre-order",
      "address": "Building 1, Shop 17",
      "status": "Open",
      "shopImage": "https://picsum.photos/seed/tech_point_17/800/400",
      "products": [
        {
          "name": "Basic Item",
          "price": "50"
        },
        {
          "name": "Premium Item",
          "price": "150"
        },
        {
          "name": "Student Combo",
          "price": "100"
        }
      ],
      "createdAt": "2025-12-15T03:56:46.861Z"
    },
    "fresh_store_18": {
      "shopId": "fresh_store_18",
      "shopName": "Fresh Store 18",
      "ownerName": "Owner 18",
      "vendorUsername": "vendor_18",
      "category": "Services",
      "description": "The best services spot on campus. Serving students since 2020.",
      "specialty": "Student Specials",
      "services": "Walk-in, Pre-order",
      "address": "Building 1, Shop 18",
      "status": "Open",
      "shopImage": "https://picsum.photos/seed/fresh_store_18/800/400",
      "products": [
        {
          "name": "Basic Item",
          "price": "50"
        },
        {
          "name": "Premium Item",
          "price": "150"
        },
        {
          "name": "Student Combo",
          "price": "100"
        }
      ],
      "createdAt": "2025-12-05T06:50:48.283Z"
    },
    "fresh_bistro_19": {
      "shopId": "fresh_bistro_19",
      "shopName": "Fresh Bistro 19",
      "ownerName": "Owner 19",
      "vendorUsername": "vendor_19",
      "category": "Retail",
      "description": "The best retail spot on campus. Serving students since 2020.",
      "specialty": "Student Specials",
      "services": "Walk-in, Pre-order",
      "address": "Building 1, Shop 19",
      "status": "Open",
      "shopImage": "https://picsum.photos/seed/fresh_bistro_19/800/400",
      "products": [
        {
          "name": "Basic Item",
          "price": "50"
        },
        {
          "name": "Premium Item",
          "price": "150"
        },
        {
          "name": "Student Combo",
          "price": "100"
        }
      ],
      "createdAt": "2025-12-04T20:17:13.492Z"
    },
    "super_corner_20": {
      "shopId": "super_corner_20",
      "shopName": "Super Corner 20",
      "ownerName": "Owner 20",
      "vendorUsername": "vendor_20",
      "category": "Retail",
      "description": "The best retail spot on campus. Serving students since 2020.",
      "specialty": "Student Specials",
      "services": "Walk-in, Pre-order",
      "address": "Building 5, Shop 20",
      "status": "Open",
      "shopImage": "https://picsum.photos/seed/super_corner_20/800/400",
      "products": [
        {
          "name": "Basic Item",
          "price": "50"
        },
        {
          "name": "Premium Item",
          "price": "150"
        },
        {
          "name": "Student Combo",
          "price": "100"
        }
      ],
      "createdAt": "2025-12-12T01:49:27.429Z"
    },
    "campus_station_21": {
      "shopId": "campus_station_21",
      "shopName": "Campus Station 21",
      "ownerName": "Owner 21",
      "vendorUsername": "vendor_21",
      "category": "Retail",
      "description": "The best retail spot on campus. Serving students since 2020.",
      "specialty": "Student Specials",
      "services": "Walk-in, Pre-order",
      "address": "Building 6, Shop 21",
      "status": "Open",
      "shopImage": "https://picsum.photos/seed/campus_station_21/800/400",
      "products": [
        {
          "name": "Basic Item",
          "price": "50"
        },
        {
          "name": "Premium Item",
          "price": "150"
        },
        {
          "name": "Student Combo",
          "price": "100"
        }
      ],
      "createdAt": "2025-12-05T07:28:34.605Z"
    },
    "uni_hub_22": {
      "shopId": "uni_hub_22",
      "shopName": "Uni Hub 22",
      "ownerName": "Owner 22",
      "vendorUsername": "vendor_22",
      "category": "Food",
      "description": "The best food spot on campus. Serving students since 2020.",
      "specialty": "Student Specials",
      "services": "Walk-in, Pre-order",
      "address": "Building 6, Shop 22",
      "status": "Open",
      "shopImage": "https://picsum.photos/seed/uni_hub_22/800/400",
      "products": [
        {
          "name": "Basic Item",
          "price": "50"
        },
        {
          "name": "Premium Item",
          "price": "150"
        },
        {
          "name": "Student Combo",
          "price": "100"
        }
      ],
      "createdAt": "2025-12-04T00:31:23.863Z"
    },
    "tech_store_23": {
      "shopId": "tech_store_23",
      "shopName": "Tech Store 23",
      "ownerName": "Owner 23",
      "vendorUsername": "vendor_23",
      "category": "Retail",
      "description": "The best retail spot on campus. Serving students since 2020.",
      "specialty": "Student Specials",
      "services": "Walk-in, Pre-order",
      "address": "Building 5, Shop 23",
      "status": "Open",
      "shopImage": "https://picsum.photos/seed/tech_store_23/800/400",
      "products": [
        {
          "name": "Basic Item",
          "price": "50"
        },
        {
          "name": "Premium Item",
          "price": "150"
        },
        {
          "name": "Student Combo",
          "price": "100"
        }
      ],
      "createdAt": "2025-12-02T14:41:34.755Z"
    },
    "super_mart_24": {
      "shopId": "super_mart_24",
      "shopName": "Super Mart 24",
      "ownerName": "Owner 24",
      "vendorUsername": "vendor_24",
      "category": "Retail",
      "description": "The best retail spot on campus. Serving students since 2020.",
      "specialty": "Student Specials",
      "services": "Walk-in, Pre-order",
      "address": "Building 7, Shop 24",
      "status": "Open",
      "shopImage": "https://picsum.photos/seed/super_mart_24/800/400",
      "products": [
        {
          "name": "Basic Item",
          "price": "50"
        },
        {
          "name": "Premium Item",
          "price": "150"
        },
        {
          "name": "Student Combo",
          "price": "100"
        }
      ],
      "createdAt": "2025-12-23T09:34:21.391Z"
    },
    "fresh_cafe_25": {
      "shopId": "fresh_cafe_25",
      "shopName": "Fresh Cafe 25",
      "ownerName": "Owner 25",
      "vendorUsername": "vendor_25",
      "category": "Stationery",
      "description": "The best stationery spot on campus. Serving students since 2020.",
      "specialty": "Student Specials",
      "services": "Walk-in, Pre-order",
      "address": "Building 8, Shop 25",
      "status": "Open",
      "shopImage": "https://picsum.photos/seed/fresh_cafe_25/800/400",
      "products": [
        {
          "name": "Basic Item",
          "price": "50"
        },
        {
          "name": "Premium Item",
          "price": "150"
        },
        {
          "name": "Student Combo",
          "price": "100"
        }
      ],
      "createdAt": "2025-12-26T12:19:26.675Z"
    },
    "tech_station_26": {
      "shopId": "tech_station_26",
      "shopName": "Tech Station 26",
      "ownerName": "Owner 26",
      "vendorUsername": "vendor_26",
      "category": "Retail",
      "description": "The best retail spot on campus. Serving students since 2020.",
      "specialty": "Student Specials",
      "services": "Walk-in, Pre-order",
      "address": "Building 9, Shop 26",
      "status": "Open",
      "shopImage": "https://picsum.photos/seed/tech_station_26/800/400",
      "products": [
        {
          "name": "Basic Item",
          "price": "50"
        },
        {
          "name": "Premium Item",
          "price": "150"
        },
        {
          "name": "Student Combo",
          "price": "100"
        }
      ],
      "createdAt": "2025-12-05T17:55:10.152Z"
    },
    "campus_cafe_27": {
      "shopId": "campus_cafe_27",
      "shopName": "Campus Cafe 27",
      "ownerName": "Owner 27",
      "vendorUsername": "vendor_27",
      "category": "Services",
      "description": "The best services spot on campus. Serving students since 2020.",
      "specialty": "Student Specials",
      "services": "Walk-in, Pre-order",
      "address": "Building 4, Shop 27",
      "status": "Open",
      "shopImage": "https://picsum.photos/seed/campus_cafe_27/800/400",
      "products": [
        {
          "name": "Basic Item",
          "price": "50"
        },
        {
          "name": "Premium Item",
          "price": "150"
        },
        {
          "name": "Student Combo",
          "price": "100"
        }
      ],
      "createdAt": "2025-12-12T18:31:18.356Z"
    },
    "daily_cafe_28": {
      "shopId": "daily_cafe_28",
      "shopName": "Daily Cafe 28",
      "ownerName": "Owner 28",
      "vendorUsername": "vendor_28",
      "category": "Retail",
      "description": "The best retail spot on campus. Serving students since 2020.",
      "specialty": "Student Specials",
      "services": "Walk-in, Pre-order",
      "address": "Building 1, Shop 28",
      "status": "Open",
      "shopImage": "https://picsum.photos/seed/daily_cafe_28/800/400",
      "products": [
        {
          "name": "Basic Item",
          "price": "50"
        },
        {
          "name": "Premium Item",
          "price": "150"
        },
        {
          "name": "Student Combo",
          "price": "100"
        }
      ],
      "createdAt": "2025-12-11T13:48:13.228Z"
    },
    "quick_corner_29": {
      "shopId": "quick_corner_29",
      "shopName": "Quick Corner 29",
      "ownerName": "Owner 29",
      "vendorUsername": "vendor_29",
      "category": "Services",
      "description": "The best services spot on campus. Serving students since 2020.",
      "specialty": "Student Specials",
      "services": "Walk-in, Pre-order",
      "address": "Building 8, Shop 29",
      "status": "Open",
      "shopImage": "https://picsum.photos/seed/quick_corner_29/800/400",
      "products": [
        {
          "name": "Basic Item",
          "price": "50"
        },
        {
          "name": "Premium Item",
          "price": "150"
        },
        {
          "name": "Student Combo",
          "price": "100"
        }
      ],
      "createdAt": "2025-12-22T06:30:01.698Z"
    },
    "fresh_store_30": {
      "shopId": "fresh_store_30",
      "shopName": "Fresh Store 30",
      "ownerName": "Owner 30",
      "vendorUsername": "vendor_30",
      "category": "Food",
      "description": "The best food spot on campus. Serving students since 2020.",
      "specialty": "Student Specials",
      "services": "Walk-in, Pre-order",
      "address": "Building 5, Shop 30",
      "status": "Open",
      "shopImage": "https://picsum.photos/seed/fresh_store_30/800/400",
      "products": [
        {
          "name": "Basic Item",
          "price": "50"
        },
        {
          "name": "Premium Item",
          "price": "150"
        },
        {
          "name": "Student Combo",
          "price": "100"
        }
      ],
      "createdAt": "2025-12-05T17:31:05.501Z"
    },
    "fresh_spot_31": {
      "shopId": "fresh_spot_31",
      "shopName": "Fresh Spot 31",
      "ownerName": "Owner 31",
      "vendorUsername": "vendor_31",
      "category": "Services",
      "description": "The best services spot on campus. Serving students since 2020.",
      "specialty": "Student Specials",
      "services": "Walk-in, Pre-order",
      "address": "Building 6, Shop 31",
      "status": "Open",
      "shopImage": "https://picsum.photos/seed/fresh_spot_31/800/400",
      "products": [
        {
          "name": "Basic Item",
          "price": "50"
        },
        {
          "name": "Premium Item",
          "price": "150"
        },
        {
          "name": "Student Combo",
          "price": "100"
        }
      ],
      "createdAt": "2025-12-18T22:52:40.901Z"
    },
    "quick_hub_32": {
      "shopId": "quick_hub_32",
      "shopName": "Quick Hub 32",
      "ownerName": "Owner 32",
      "vendorUsername": "vendor_32",
      "category": "Stationery",
      "description": "The best stationery spot on campus. Serving students since 2020.",
      "specialty": "Student Specials",
      "services": "Walk-in, Pre-order",
      "address": "Building 10, Shop 32",
      "status": "Open",
      "shopImage": "https://picsum.photos/seed/quick_hub_32/800/400",
      "products": [
        {
          "name": "Basic Item",
          "price": "50"
        },
        {
          "name": "Premium Item",
          "price": "150"
        },
        {
          "name": "Student Combo",
          "price": "100"
        }
      ],
      "createdAt": "2025-12-21T16:52:33.479Z"
    },
    "fast_cafe_33": {
      "shopId": "fast_cafe_33",
      "shopName": "Fast Cafe 33",
      "ownerName": "Owner 33",
      "vendorUsername": "vendor_33",
      "category": "Services",
      "description": "The best services spot on campus. Serving students since 2020.",
      "specialty": "Student Specials",
      "services": "Walk-in, Pre-order",
      "address": "Building 9, Shop 33",
      "status": "Open",
      "shopImage": "https://picsum.photos/seed/fast_cafe_33/800/400",
      "products": [
        {
          "name": "Basic Item",
          "price": "50"
        },
        {
          "name": "Premium Item",
          "price": "150"
        },
        {
          "name": "Student Combo",
          "price": "100"
        }
      ],
      "createdAt": "2025-12-21T07:13:40.042Z"
    },
    "tech_cafe_34": {
      "shopId": "tech_cafe_34",
      "shopName": "Tech Cafe 34",
      "ownerName": "Owner 34",
      "vendorUsername": "vendor_34",
      "category": "Food",
      "description": "The best food spot on campus. Serving students since 2020.",
      "specialty": "Student Specials",
      "services": "Walk-in, Pre-order",
      "address": "Building 1, Shop 34",
      "status": "Open",
      "shopImage": "https://picsum.photos/seed/tech_cafe_34/800/400",
      "products": [
        {
          "name": "Basic Item",
          "price": "50"
        },
        {
          "name": "Premium Item",
          "price": "150"
        },
        {
          "name": "Student Combo",
          "price": "100"
        }
      ],
      "createdAt": "2025-11-29T03:28:58.882Z"
    },
    "city_spot_35": {
      "shopId": "city_spot_35",
      "shopName": "City Spot 35",
      "ownerName": "Owner 35",
      "vendorUsername": "vendor_35",
      "category": "Retail",
      "description": "The best retail spot on campus. Serving students since 2020.",
      "specialty": "Student Specials",
      "services": "Walk-in, Pre-order",
      "address": "Building 2, Shop 35",
      "status": "Open",
      "shopImage": "https://picsum.photos/seed/city_spot_35/800/400",
      "products": [
        {
          "name": "Basic Item",
          "price": "50"
        },
        {
          "name": "Premium Item",
          "price": "150"
        },
        {
          "name": "Student Combo",
          "price": "100"
        }
      ],
      "createdAt": "2025-12-11T16:37:38.766Z"
    },
    "fast_bistro_36": {
      "shopId": "fast_bistro_36",
      "shopName": "Fast Bistro 36",
      "ownerName": "Owner 36",
      "vendorUsername": "vendor_36",
      "category": "Stationery",
      "description": "The best stationery spot on campus. Serving students since 2020.",
      "specialty": "Student Specials",
      "services": "Walk-in, Pre-order",
      "address": "Building 1, Shop 36",
      "status": "Open",
      "shopImage": "https://picsum.photos/seed/fast_bistro_36/800/400",
      "products": [
        {
          "name": "Basic Item",
          "price": "50"
        },
        {
          "name": "Premium Item",
          "price": "150"
        },
        {
          "name": "Student Combo",
          "price": "100"
        }
      ],
      "createdAt": "2025-12-11T05:10:00.343Z"
    },
    "fresh_spot_37": {
      "shopId": "fresh_spot_37",
      "shopName": "Fresh Spot 37",
      "ownerName": "Owner 37",
      "vendorUsername": "vendor_37",
      "category": "Services",
      "description": "The best services spot on campus. Serving students since 2020.",
      "specialty": "Student Specials",
      "services": "Walk-in, Pre-order",
      "address": "Building 5, Shop 37",
      "status": "Open",
      "shopImage": "https://picsum.photos/seed/fresh_spot_37/800/400",
      "products": [
        {
          "name": "Basic Item",
          "price": "50"
        },
        {
          "name": "Premium Item",
          "price": "150"
        },
        {
          "name": "Student Combo",
          "price": "100"
        }
      ],
      "createdAt": "2025-12-03T11:42:29.439Z"
    },
    "fast_hub_38": {
      "shopId": "fast_hub_38",
      "shopName": "Fast Hub 38",
      "ownerName": "Owner 38",
      "vendorUsername": "vendor_38",
      "category": "Food",
      "description": "The best food spot on campus. Serving students since 2020.",
      "specialty": "Student Specials",
      "services": "Walk-in, Pre-order",
      "address": "Building 9, Shop 38",
      "status": "Open",
      "shopImage": "https://picsum.photos/seed/fast_hub_38/800/400",
      "products": [
        {
          "name": "Basic Item",
          "price": "50"
        },
        {
          "name": "Premium Item",
          "price": "150"
        },
        {
          "name": "Student Combo",
          "price": "100"
        }
      ],
      "createdAt": "2025-12-19T20:14:39.953Z"
    },
    "fast_zone_39": {
      "shopId": "fast_zone_39",
      "shopName": "Fast Zone 39",
      "ownerName": "Owner 39",
      "vendorUsername": "vendor_39",
      "category": "Services",
      "description": "The best services spot on campus. Serving students since 2020.",
      "specialty": "Student Specials",
      "services": "Walk-in, Pre-order",
      "address": "Building 3, Shop 39",
      "status": "Open",
      "shopImage": "https://picsum.photos/seed/fast_zone_39/800/400",
      "products": [
        {
          "name": "Basic Item",
          "price": "50"
        },
        {
          "name": "Premium Item",
          "price": "150"
        },
        {
          "name": "Student Combo",
          "price": "100"
        }
      ],
      "createdAt": "2025-12-06T12:18:50.820Z"
    },
    "uni_hub_40": {
      "shopId": "uni_hub_40",
      "shopName": "Uni Hub 40",
      "ownerName": "Owner 40",
      "vendorUsername": "vendor_40",
      "category": "Services",
      "description": "The best services spot on campus. Serving students since 2020.",
      "specialty": "Student Specials",
      "services": "Walk-in, Pre-order",
      "address": "Building 5, Shop 40",
      "status": "Open",
      "shopImage": "https://picsum.photos/seed/uni_hub_40/800/400",
      "products": [
        {
          "name": "Basic Item",
          "price": "50"
        },
        {
          "name": "Premium Item",
          "price": "150"
        },
        {
          "name": "Student Combo",
          "price": "100"
        }
      ],
      "createdAt": "2025-12-02T22:35:56.008Z"
    },
    "tech_store_41": {
      "shopId": "tech_store_41",
      "shopName": "Tech Store 41",
      "ownerName": "Owner 41",
      "vendorUsername": "vendor_41",
      "category": "Retail",
      "description": "The best retail spot on campus. Serving students since 2020.",
      "specialty": "Student Specials",
      "services": "Walk-in, Pre-order",
      "address": "Building 5, Shop 41",
      "status": "Open",
      "shopImage": "https://picsum.photos/seed/tech_store_41/800/400",
      "products": [
        {
          "name": "Basic Item",
          "price": "50"
        },
        {
          "name": "Premium Item",
          "price": "150"
        },
        {
          "name": "Student Combo",
          "price": "100"
        }
      ],
      "createdAt": "2025-12-03T19:25:29.714Z"
    },
    "fresh_mart_42": {
      "shopId": "fresh_mart_42",
      "shopName": "Fresh Mart 42",
      "ownerName": "Owner 42",
      "vendorUsername": "vendor_42",
      "category": "Food",
      "description": "The best food spot on campus. Serving students since 2020.",
      "specialty": "Student Specials",
      "services": "Walk-in, Pre-order",
      "address": "Building 3, Shop 42",
      "status": "Open",
      "shopImage": "https://picsum.photos/seed/fresh_mart_42/800/400",
      "products": [
        {
          "name": "Basic Item",
          "price": "50"
        },
        {
          "name": "Premium Item",
          "price": "150"
        },
        {
          "name": "Student Combo",
          "price": "100"
        }
      ],
      "createdAt": "2025-12-13T22:00:53.804Z"
    },
    "fresh_cafe_43": {
      "shopId": "fresh_cafe_43",
      "shopName": "Fresh Cafe 43",
      "ownerName": "Owner 43",
      "vendorUsername": "vendor_43",
      "category": "Retail",
      "description": "The best retail spot on campus. Serving students since 2020.",
      "specialty": "Student Specials",
      "services": "Walk-in, Pre-order",
      "address": "Building 7, Shop 43",
      "status": "Open",
      "shopImage": "https://picsum.photos/seed/fresh_cafe_43/800/400",
      "products": [
        {
          "name": "Basic Item",
          "price": "50"
        },
        {
          "name": "Premium Item",
          "price": "150"
        },
        {
          "name": "Student Combo",
          "price": "100"
        }
      ],
      "createdAt": "2025-12-09T04:46:19.086Z"
    },
    "super_cafe_44": {
      "shopId": "super_cafe_44",
      "shopName": "Super Cafe 44",
      "ownerName": "Owner 44",
      "vendorUsername": "vendor_44",
      "category": "Services",
      "description": "The best services spot on campus. Serving students since 2020.",
      "specialty": "Student Specials",
      "services": "Walk-in, Pre-order",
      "address": "Building 1, Shop 44",
      "status": "Open",
      "shopImage": "https://picsum.photos/seed/super_cafe_44/800/400",
      "products": [
        {
          "name": "Basic Item",
          "price": "50"
        },
        {
          "name": "Premium Item",
          "price": "150"
        },
        {
          "name": "Student Combo",
          "price": "100"
        }
      ],
      "createdAt": "2025-11-30T01:45:30.807Z"
    },
    "student_store_45": {
      "shopId": "student_store_45",
      "shopName": "Student Store 45",
      "ownerName": "Owner 45",
      "vendorUsername": "vendor_45",
      "category": "Stationery",
      "description": "The best stationery spot on campus. Serving students since 2020.",
      "specialty": "Student Specials",
      "services": "Walk-in, Pre-order",
      "address": "Building 2, Shop 45",
      "status": "Open",
      "shopImage": "https://picsum.photos/seed/student_store_45/800/400",
      "products": [
        {
          "name": "Basic Item",
          "price": "50"
        },
        {
          "name": "Premium Item",
          "price": "150"
        },
        {
          "name": "Student Combo",
          "price": "100"
        }
      ],
      "createdAt": "2025-12-09T20:50:02.060Z"
    },
    "city_bistro_46": {
      "shopId": "city_bistro_46",
      "shopName": "City Bistro 46",
      "ownerName": "Owner 46",
      "vendorUsername": "vendor_46",
      "category": "Retail",
      "description": "The best retail spot on campus. Serving students since 2020.",
      "specialty": "Student Specials",
      "services": "Walk-in, Pre-order",
      "address": "Building 3, Shop 46",
      "status": "Open",
      "shopImage": "https://picsum.photos/seed/city_bistro_46/800/400",
      "products": [
        {
          "name": "Basic Item",
          "price": "50"
        },
        {
          "name": "Premium Item",
          "price": "150"
        },
        {
          "name": "Student Combo",
          "price": "100"
        }
      ],
      "createdAt": "2025-12-27T14:56:56.173Z"
    },
    "uni_corner_47": {
      "shopId": "uni_corner_47",
      "shopName": "Uni Corner 47",
      "ownerName": "Owner 47",
      "vendorUsername": "vendor_47",
      "category": "Stationery",
      "description": "The best stationery spot on campus. Serving students since 2020.",
      "specialty": "Student Specials",
      "services": "Walk-in, Pre-order",
      "address": "Building 2, Shop 47",
      "status": "Open",
      "shopImage": "https://picsum.photos/seed/uni_corner_47/800/400",
      "products": [
        {
          "name": "Basic Item",
          "price": "50"
        },
        {
          "name": "Premium Item",
          "price": "150"
        },
        {
          "name": "Student Combo",
          "price": "100"
        }
      ],
      "createdAt": "2025-12-14T08:30:15.201Z"
    },
    "uni_point_48": {
      "shopId": "uni_point_48",
      "shopName": "Uni Point 48",
      "ownerName": "Owner 48",
      "vendorUsername": "vendor_48",
      "category": "Retail",
      "description": "The best retail spot on campus. Serving students since 2020.",
      "specialty": "Student Specials",
      "services": "Walk-in, Pre-order",
      "address": "Building 8, Shop 48",
      "status": "Open",
      "shopImage": "https://picsum.photos/seed/uni_point_48/800/400",
      "products": [
        {
          "name": "Basic Item",
          "price": "50"
        },
        {
          "name": "Premium Item",
          "price": "150"
        },
        {
          "name": "Student Combo",
          "price": "100"
        }
      ],
      "createdAt": "2025-12-04T08:41:03.978Z"
    },
    "student_bistro_49": {
      "shopId": "student_bistro_49",
      "shopName": "Student Bistro 49",
      "ownerName": "Owner 49",
      "vendorUsername": "vendor_49",
      "category": "Stationery",
      "description": "The best stationery spot on campus. Serving students since 2020.",
      "specialty": "Student Specials",
      "services": "Walk-in, Pre-order",
      "address": "Building 3, Shop 49",
      "status": "Open",
      "shopImage": "https://picsum.photos/seed/student_bistro_49/800/400",
      "products": [
        {
          "name": "Basic Item",
          "price": "50"
        },
        {
          "name": "Premium Item",
          "price": "150"
        },
        {
          "name": "Student Combo",
          "price": "100"
        }
      ],
      "createdAt": "2025-11-30T20:22:23.493Z"
    },
    "quick_zone_50": {
      "shopId": "quick_zone_50",
      "shopName": "Quick Zone 50",
      "ownerName": "Owner 50",
      "vendorUsername": "vendor_50",
      "category": "Retail",
      "description": "The best retail spot on campus. Serving students since 2020.",
      "specialty": "Student Specials",
      "services": "Walk-in, Pre-order",
      "address": "Building 1, Shop 50",
      "status": "Open",
      "shopImage": "https://picsum.photos/seed/quick_zone_50/800/400",
      "products": [
        {
          "name": "Basic Item",
          "price": "50"
        },
        {
          "name": "Premium Item",
          "price": "150"
        },
        {
          "name": "Student Combo",
          "price": "100"
        }
      ],
      "createdAt": "2025-12-13T21:30:47.174Z"
    }
  },
  "reviews": {
    "city_mart_1": {
      "rev_city_mart_1_0": {
        "reviewId": "rev_city_mart_1_0",
        "studentName": "Jessica Thompson",
        "studentEmail": "jessica.thompson28@university.edu",
        "rating": 5,
        "text": "Saved my assignment submission!",
        "date": "12/8/2025",
        "time": "06:10 AM",
        "timestamp": "2025-12-08T00:40:06.106Z"
      },
      "rev_city_mart_1_1": {
        "reviewId": "rev_city_mart_1_1",
        "studentName": "Abigail Khan",
        "studentEmail": "abigail.khan1@university.edu",
        "rating": 5,
        "text": "Great service!",
        "date": "12/19/2025",
        "time": "01:53 AM",
        "timestamp": "2025-12-18T20:23:00.984Z"
      },
      "rev_city_mart_1_2": {
        "reviewId": "rev_city_mart_1_2",
        "studentName": "Jessica Jackson",
        "studentEmail": "jessica.jackson23@university.edu",
        "rating": 3,
        "text": "Good quality products.",
        "date": "12/1/2025",
        "time": "06:29 AM",
        "timestamp": "2025-12-01T00:59:57.795Z"
      },
      "rev_city_mart_1_3": {
        "reviewId": "rev_city_mart_1_3",
        "studentName": "Alex White",
        "studentEmail": "alex.white16@university.edu",
        "rating": 3,
        "text": "Tasty snacks.",
        "date": "12/1/2025",
        "time": "10:16 PM",
        "timestamp": "2025-12-01T16:46:02.912Z"
      },
      "rev_city_mart_1_4": {
        "reviewId": "rev_city_mart_1_4",
        "studentName": "James Rodriguez",
        "studentEmail": "james.rodriguez26@university.edu",
        "rating": 3,
        "text": "Highly recommended!",
        "date": "11/30/2025",
        "time": "11:40 PM",
        "timestamp": "2025-11-30T18:10:04.662Z"
      },
      "rev_city_mart_1_5": {
        "reviewId": "rev_city_mart_1_5",
        "studentName": "Emily Taylor",
        "studentEmail": "emily.taylor25@university.edu",
        "rating": 4,
        "text": "Very helpful staff.",
        "date": "12/19/2025",
        "time": "09:48 PM",
        "timestamp": "2025-12-19T16:18:27.185Z"
      },
      "rev_city_mart_1_6": {
        "reviewId": "rev_city_mart_1_6",
        "studentName": "Jessica Thompson",
        "studentEmail": "jessica.thompson28@university.edu",
        "rating": 5,
        "text": "Tasty snacks.",
        "date": "12/27/2025",
        "time": "05:07 PM",
        "timestamp": "2025-12-27T11:37:40.554Z"
      },
      "rev_city_mart_1_7": {
        "reviewId": "rev_city_mart_1_7",
        "studentName": "Mike Martinez",
        "studentEmail": "mike.martinez22@university.edu",
        "rating": 5,
        "text": "Nice ambiance.",
        "date": "12/4/2025",
        "time": "11:13 AM",
        "timestamp": "2025-12-04T05:43:14.009Z"
      },
      "rev_city_mart_1_8": {
        "reviewId": "rev_city_mart_1_8",
        "studentName": "Abigail Khan",
        "studentEmail": "abigail.khan1@university.edu",
        "rating": 5,
        "text": "Loved the food.",
        "date": "12/16/2025",
        "time": "01:54 AM",
        "timestamp": "2025-12-15T20:24:23.762Z"
      },
      "rev_city_mart_1_9": {
        "reviewId": "rev_city_mart_1_9",
        "studentName": "Emily Taylor",
        "studentEmail": "emily.taylor25@university.edu",
        "rating": 5,
        "text": "Average experience.",
        "date": "12/5/2025",
        "time": "09:04 AM",
        "timestamp": "2025-12-05T03:34:28.613Z"
      },
      "rev_city_mart_1_10": {
        "reviewId": "rev_city_mart_1_10",
        "studentName": "Alex White",
        "studentEmail": "alex.white16@university.edu",
        "rating": 5,
        "text": "Will come back again.",
        "date": "12/26/2025",
        "time": "07:11 PM",
        "timestamp": "2025-12-26T13:41:51.603Z"
      },
      "rev_city_mart_1_11": {
        "reviewId": "rev_city_mart_1_11",
        "studentName": "James Connor",
        "studentEmail": "james.connor13@university.edu",
        "rating": 4,
        "text": "Could be cleaner.",
        "date": "12/3/2025",
        "time": "02:30 PM",
        "timestamp": "2025-12-03T09:00:19.345Z"
      },
      "rev_city_mart_1_12": {
        "reviewId": "rev_city_mart_1_12",
        "studentName": "Evelyn Smith",
        "studentEmail": "evelyn.smith11@university.edu",
        "rating": 4,
        "text": "Great service!",
        "date": "12/12/2025",
        "time": "02:35 PM",
        "timestamp": "2025-12-12T09:05:06.762Z"
      },
      "rev_city_mart_1_13": {
        "reviewId": "rev_city_mart_1_13",
        "studentName": "Mike Martinez",
        "studentEmail": "mike.martinez22@university.edu",
        "rating": 3,
        "text": "Nice ambiance.",
        "date": "12/23/2025",
        "time": "08:55 PM",
        "timestamp": "2025-12-23T15:25:20.972Z"
      },
      "rev_city_mart_1_14": {
        "reviewId": "rev_city_mart_1_14",
        "studentName": "Rahul Sharma",
        "studentEmail": "rahul.sharma29@university.edu",
        "rating": 4,
        "text": "Nice ambiance.",
        "date": "12/11/2025",
        "time": "04:51 PM",
        "timestamp": "2025-12-11T11:21:43.329Z"
      },
      "rev_city_mart_1_15": {
        "reviewId": "rev_city_mart_1_15",
        "studentName": "Isabella Taylor",
        "studentEmail": "isabella.taylor7@university.edu",
        "rating": 3,
        "text": "Loved the food.",
        "date": "12/27/2025",
        "time": "10:35 AM",
        "timestamp": "2025-12-27T05:05:43.893Z"
      },
      "rev_city_mart_1_16": {
        "reviewId": "rev_city_mart_1_16",
        "studentName": "Daniel White",
        "studentEmail": "daniel.white9@university.edu",
        "rating": 3,
        "text": "Nice ambiance.",
        "date": "12/16/2025",
        "time": "01:25 AM",
        "timestamp": "2025-12-15T19:55:30.449Z"
      },
      "rev_city_mart_1_17": {
        "reviewId": "rev_city_mart_1_17",
        "studentName": "James Anderson",
        "studentEmail": "james.anderson3@university.edu",
        "rating": 5,
        "text": "A bit expensive but worth it.",
        "date": "12/10/2025",
        "time": "04:55 PM",
        "timestamp": "2025-12-10T11:25:02.777Z"
      },
      "rev_city_mart_1_18": {
        "reviewId": "rev_city_mart_1_18",
        "studentName": "Isabella Taylor",
        "studentEmail": "isabella.taylor7@university.edu",
        "rating": 3,
        "text": "Tasty snacks.",
        "date": "12/20/2025",
        "time": "12:20 AM",
        "timestamp": "2025-12-19T18:50:29.483Z"
      },
      "rev_city_mart_1_19": {
        "reviewId": "rev_city_mart_1_19",
        "studentName": "Tom Walker",
        "studentEmail": "tom.walker4@university.edu",
        "rating": 3,
        "text": "Friendly owner.",
        "date": "12/27/2025",
        "time": "03:01 PM",
        "timestamp": "2025-12-27T09:31:59.255Z"
      }
    },
    "quick_bistro_2": {
      "rev_quick_bistro_2_0": {
        "reviewId": "rev_quick_bistro_2_0",
        "studentName": "William Lewis",
        "studentEmail": "william.lewis21@university.edu",
        "rating": 3,
        "text": "A bit expensive but worth it.",
        "date": "12/10/2025",
        "time": "05:15 AM",
        "timestamp": "2025-12-09T23:45:19.510Z"
      },
      "rev_quick_bistro_2_1": {
        "reviewId": "rev_quick_bistro_2_1",
        "studentName": "Jessica Thompson",
        "studentEmail": "jessica.thompson28@university.edu",
        "rating": 5,
        "text": "Could be cleaner.",
        "date": "12/6/2025",
        "time": "05:13 PM",
        "timestamp": "2025-12-06T11:43:03.120Z"
      },
      "rev_quick_bistro_2_2": {
        "reviewId": "rev_quick_bistro_2_2",
        "studentName": "James Anderson",
        "studentEmail": "james.anderson3@university.edu",
        "rating": 4,
        "text": "Tasty snacks.",
        "date": "12/9/2025",
        "time": "09:54 PM",
        "timestamp": "2025-12-09T16:24:51.425Z"
      },
      "rev_quick_bistro_2_3": {
        "reviewId": "rev_quick_bistro_2_3",
        "studentName": "Mike Martinez",
        "studentEmail": "mike.martinez22@university.edu",
        "rating": 4,
        "text": "Quick and easy.",
        "date": "12/24/2025",
        "time": "09:01 AM",
        "timestamp": "2025-12-24T03:31:32.661Z"
      },
      "rev_quick_bistro_2_4": {
        "reviewId": "rev_quick_bistro_2_4",
        "studentName": "Tom Connor",
        "studentEmail": "tom.connor2@university.edu",
        "rating": 4,
        "text": "Friendly owner.",
        "date": "12/2/2025",
        "time": "07:33 AM",
        "timestamp": "2025-12-02T02:03:44.545Z"
      },
      "rev_quick_bistro_2_5": {
        "reviewId": "rev_quick_bistro_2_5",
        "studentName": "Jessica Thompson",
        "studentEmail": "jessica.thompson28@university.edu",
        "rating": 5,
        "text": "Could be cleaner.",
        "date": "12/23/2025",
        "time": "12:55 PM",
        "timestamp": "2025-12-23T07:25:19.772Z"
      },
      "rev_quick_bistro_2_6": {
        "reviewId": "rev_quick_bistro_2_6",
        "studentName": "Alex White",
        "studentEmail": "alex.white16@university.edu",
        "rating": 5,
        "text": "Will come back again.",
        "date": "12/5/2025",
        "time": "08:44 AM",
        "timestamp": "2025-12-05T03:14:56.875Z"
      },
      "rev_quick_bistro_2_7": {
        "reviewId": "rev_quick_bistro_2_7",
        "studentName": "Isabella Smith",
        "studentEmail": "isabella.smith30@university.edu",
        "rating": 3,
        "text": "Nice ambiance.",
        "date": "12/9/2025",
        "time": "09:16 PM",
        "timestamp": "2025-12-09T15:46:03.510Z"
      },
      "rev_quick_bistro_2_8": {
        "reviewId": "rev_quick_bistro_2_8",
        "studentName": "Isabella Rodriguez",
        "studentEmail": "isabella.rodriguez8@university.edu",
        "rating": 5,
        "text": "Quick and easy.",
        "date": "12/21/2025",
        "time": "07:07 AM",
        "timestamp": "2025-12-21T01:37:59.123Z"
      },
      "rev_quick_bistro_2_9": {
        "reviewId": "rev_quick_bistro_2_9",
        "studentName": "Isabella Smith",
        "studentEmail": "isabella.smith10@university.edu",
        "rating": 3,
        "text": "Good quality products.",
        "date": "12/25/2025",
        "time": "02:47 PM",
        "timestamp": "2025-12-25T09:17:39.175Z"
      },
      "rev_quick_bistro_2_10": {
        "reviewId": "rev_quick_bistro_2_10",
        "studentName": "James Anderson",
        "studentEmail": "james.anderson3@university.edu",
        "rating": 4,
        "text": "Very helpful staff.",
        "date": "12/7/2025",
        "time": "12:26 AM",
        "timestamp": "2025-12-06T18:56:45.487Z"
      },
      "rev_quick_bistro_2_11": {
        "reviewId": "rev_quick_bistro_2_11",
        "studentName": "Daniel White",
        "studentEmail": "daniel.white9@university.edu",
        "rating": 4,
        "text": "Saved my assignment submission!",
        "date": "12/23/2025",
        "time": "04:22 AM",
        "timestamp": "2025-12-22T22:52:49.316Z"
      },
      "rev_quick_bistro_2_12": {
        "reviewId": "rev_quick_bistro_2_12",
        "studentName": "Jessica Jackson",
        "studentEmail": "jessica.jackson23@university.edu",
        "rating": 5,
        "text": "Will come back again.",
        "date": "12/8/2025",
        "time": "11:33 AM",
        "timestamp": "2025-12-08T06:03:08.631Z"
      },
      "rev_quick_bistro_2_13": {
        "reviewId": "rev_quick_bistro_2_13",
        "studentName": "Jessica Walker",
        "studentEmail": "jessica.walker20@university.edu",
        "rating": 5,
        "text": "Average experience.",
        "date": "12/19/2025",
        "time": "04:50 AM",
        "timestamp": "2025-12-18T23:20:13.351Z"
      },
      "rev_quick_bistro_2_14": {
        "reviewId": "rev_quick_bistro_2_14",
        "studentName": "Abigail Rodriguez",
        "studentEmail": "abigail.rodriguez24@university.edu",
        "rating": 4,
        "text": "Could be cleaner.",
        "date": "12/22/2025",
        "time": "03:46 AM",
        "timestamp": "2025-12-21T22:16:31.022Z"
      },
      "rev_quick_bistro_2_15": {
        "reviewId": "rev_quick_bistro_2_15",
        "studentName": "William Lewis",
        "studentEmail": "william.lewis21@university.edu",
        "rating": 5,
        "text": "Could be cleaner.",
        "date": "12/9/2025",
        "time": "03:28 PM",
        "timestamp": "2025-12-09T09:58:47.384Z"
      },
      "rev_quick_bistro_2_16": {
        "reviewId": "rev_quick_bistro_2_16",
        "studentName": "Chen Day",
        "studentEmail": "chen.day5@university.edu",
        "rating": 4,
        "text": "Loved the food.",
        "date": "12/11/2025",
        "time": "08:20 AM",
        "timestamp": "2025-12-11T02:50:43.010Z"
      },
      "rev_quick_bistro_2_17": {
        "reviewId": "rev_quick_bistro_2_17",
        "studentName": "Sophia Garcia",
        "studentEmail": "sophia.garcia17@university.edu",
        "rating": 4,
        "text": "Tasty snacks.",
        "date": "12/29/2025",
        "time": "07:10 AM",
        "timestamp": "2025-12-29T01:40:18.474Z"
      },
      "rev_quick_bistro_2_18": {
        "reviewId": "rev_quick_bistro_2_18",
        "studentName": "Thomas Day",
        "studentEmail": "thomas.day15@university.edu",
        "rating": 3,
        "text": "Will come back again.",
        "date": "12/13/2025",
        "time": "12:21 AM",
        "timestamp": "2025-12-12T18:51:58.145Z"
      },
      "rev_quick_bistro_2_19": {
        "reviewId": "rev_quick_bistro_2_19",
        "studentName": "Isabella Rodriguez",
        "studentEmail": "isabella.rodriguez8@university.edu",
        "rating": 4,
        "text": "Average experience.",
        "date": "12/28/2025",
        "time": "07:18 PM",
        "timestamp": "2025-12-28T13:48:48.918Z"
      }
    },
    "daily_hub_3": {
      "rev_daily_hub_3_0": {
        "reviewId": "rev_daily_hub_3_0",
        "studentName": "Jessica Walker",
        "studentEmail": "jessica.walker20@university.edu",
        "rating": 5,
        "text": "Good quality products.",
        "date": "12/22/2025",
        "time": "04:33 PM",
        "timestamp": "2025-12-22T11:03:26.638Z"
      },
      "rev_daily_hub_3_1": {
        "reviewId": "rev_daily_hub_3_1",
        "studentName": "Abigail Rodriguez",
        "studentEmail": "abigail.rodriguez24@university.edu",
        "rating": 4,
        "text": "Could be cleaner.",
        "date": "12/13/2025",
        "time": "11:30 AM",
        "timestamp": "2025-12-13T06:00:11.591Z"
      },
      "rev_daily_hub_3_2": {
        "reviewId": "rev_daily_hub_3_2",
        "studentName": "Robert Harris",
        "studentEmail": "robert.harris14@university.edu",
        "rating": 4,
        "text": "Could be cleaner.",
        "date": "12/11/2025",
        "time": "04:53 PM",
        "timestamp": "2025-12-11T11:23:11.809Z"
      },
      "rev_daily_hub_3_3": {
        "reviewId": "rev_daily_hub_3_3",
        "studentName": "William Lewis",
        "studentEmail": "william.lewis21@university.edu",
        "rating": 5,
        "text": "Tasty snacks.",
        "date": "12/26/2025",
        "time": "07:48 PM",
        "timestamp": "2025-12-26T14:18:46.785Z"
      },
      "rev_daily_hub_3_4": {
        "reviewId": "rev_daily_hub_3_4",
        "studentName": "James Anderson",
        "studentEmail": "james.anderson3@university.edu",
        "rating": 3,
        "text": "Saved my assignment submission!",
        "date": "12/26/2025",
        "time": "07:58 AM",
        "timestamp": "2025-12-26T02:28:54.793Z"
      },
      "rev_daily_hub_3_5": {
        "reviewId": "rev_daily_hub_3_5",
        "studentName": "Sophia Garcia",
        "studentEmail": "sophia.garcia17@university.edu",
        "rating": 5,
        "text": "Average experience.",
        "date": "12/2/2025",
        "time": "03:47 PM",
        "timestamp": "2025-12-02T10:17:45.233Z"
      },
      "rev_daily_hub_3_6": {
        "reviewId": "rev_daily_hub_3_6",
        "studentName": "David Wilson",
        "studentEmail": "david.wilson19@university.edu",
        "rating": 4,
        "text": "Quick and easy.",
        "date": "12/30/2025",
        "time": "03:25 AM",
        "timestamp": "2025-12-29T21:55:47.691Z"
      },
      "rev_daily_hub_3_7": {
        "reviewId": "rev_daily_hub_3_7",
        "studentName": "Chen Day",
        "studentEmail": "chen.day5@university.edu",
        "rating": 3,
        "text": "Loved the food.",
        "date": "12/13/2025",
        "time": "02:43 PM",
        "timestamp": "2025-12-13T09:13:05.435Z"
      },
      "rev_daily_hub_3_8": {
        "reviewId": "rev_daily_hub_3_8",
        "studentName": "Isabella Rodriguez",
        "studentEmail": "isabella.rodriguez8@university.edu",
        "rating": 3,
        "text": "Loved the food.",
        "date": "12/21/2025",
        "time": "08:54 AM",
        "timestamp": "2025-12-21T03:24:22.547Z"
      },
      "rev_daily_hub_3_9": {
        "reviewId": "rev_daily_hub_3_9",
        "studentName": "James Anderson",
        "studentEmail": "james.anderson3@university.edu",
        "rating": 4,
        "text": "A bit expensive but worth it.",
        "date": "12/4/2025",
        "time": "01:06 AM",
        "timestamp": "2025-12-03T19:36:34.910Z"
      },
      "rev_daily_hub_3_10": {
        "reviewId": "rev_daily_hub_3_10",
        "studentName": "David Wilson",
        "studentEmail": "david.wilson19@university.edu",
        "rating": 5,
        "text": "Great service!",
        "date": "12/23/2025",
        "time": "11:53 PM",
        "timestamp": "2025-12-23T18:23:24.704Z"
      },
      "rev_daily_hub_3_11": {
        "reviewId": "rev_daily_hub_3_11",
        "studentName": "Tom Connor",
        "studentEmail": "tom.connor2@university.edu",
        "rating": 3,
        "text": "Average experience.",
        "date": "12/27/2025",
        "time": "11:02 PM",
        "timestamp": "2025-12-27T17:32:42.231Z"
      },
      "rev_daily_hub_3_12": {
        "reviewId": "rev_daily_hub_3_12",
        "studentName": "Isabella Smith",
        "studentEmail": "isabella.smith30@university.edu",
        "rating": 3,
        "text": "Could be cleaner.",
        "date": "12/5/2025",
        "time": "06:40 PM",
        "timestamp": "2025-12-05T13:10:01.334Z"
      },
      "rev_daily_hub_3_13": {
        "reviewId": "rev_daily_hub_3_13",
        "studentName": "Tom Walker",
        "studentEmail": "tom.walker4@university.edu",
        "rating": 5,
        "text": "Quick and easy.",
        "date": "11/30/2025",
        "time": "10:46 AM",
        "timestamp": "2025-11-30T05:16:17.380Z"
      },
      "rev_daily_hub_3_14": {
        "reviewId": "rev_daily_hub_3_14",
        "studentName": "Rahul Sharma",
        "studentEmail": "rahul.sharma29@university.edu",
        "rating": 3,
        "text": "Tasty snacks.",
        "date": "12/22/2025",
        "time": "07:46 PM",
        "timestamp": "2025-12-22T14:16:30.124Z"
      },
      "rev_daily_hub_3_15": {
        "reviewId": "rev_daily_hub_3_15",
        "studentName": "Isabella Rodriguez",
        "studentEmail": "isabella.rodriguez8@university.edu",
        "rating": 5,
        "text": "Highly recommended!",
        "date": "12/8/2025",
        "time": "11:58 PM",
        "timestamp": "2025-12-08T18:28:13.245Z"
      },
      "rev_daily_hub_3_16": {
        "reviewId": "rev_daily_hub_3_16",
        "studentName": "David Taylor",
        "studentEmail": "david.taylor12@university.edu",
        "rating": 3,
        "text": "Loved the food.",
        "date": "12/27/2025",
        "time": "01:41 AM",
        "timestamp": "2025-12-26T20:11:34.429Z"
      },
      "rev_daily_hub_3_17": {
        "reviewId": "rev_daily_hub_3_17",
        "studentName": "William Lewis",
        "studentEmail": "william.lewis21@university.edu",
        "rating": 5,
        "text": "Will come back again.",
        "date": "12/13/2025",
        "time": "05:42 PM",
        "timestamp": "2025-12-13T12:12:51.933Z"
      },
      "rev_daily_hub_3_18": {
        "reviewId": "rev_daily_hub_3_18",
        "studentName": "Charles Ross",
        "studentEmail": "charles.ross6@university.edu",
        "rating": 5,
        "text": "Good quality products.",
        "date": "12/16/2025",
        "time": "11:06 AM",
        "timestamp": "2025-12-16T05:36:32.464Z"
      },
      "rev_daily_hub_3_19": {
        "reviewId": "rev_daily_hub_3_19",
        "studentName": "Emily Taylor",
        "studentEmail": "emily.taylor25@university.edu",
        "rating": 3,
        "text": "Good quality products.",
        "date": "12/5/2025",
        "time": "04:14 PM",
        "timestamp": "2025-12-05T10:44:40.092Z"
      }
    },
    "campus_corner_4": {
      "rev_campus_corner_4_0": {
        "reviewId": "rev_campus_corner_4_0",
        "studentName": "Emily Taylor",
        "studentEmail": "emily.taylor25@university.edu",
        "rating": 5,
        "text": "Quick and easy.",
        "date": "12/16/2025",
        "time": "05:59 AM",
        "timestamp": "2025-12-16T00:29:49.952Z"
      },
      "rev_campus_corner_4_1": {
        "reviewId": "rev_campus_corner_4_1",
        "studentName": "Thomas Day",
        "studentEmail": "thomas.day15@university.edu",
        "rating": 4,
        "text": "Could be cleaner.",
        "date": "12/26/2025",
        "time": "04:44 PM",
        "timestamp": "2025-12-26T11:14:37.728Z"
      },
      "rev_campus_corner_4_2": {
        "reviewId": "rev_campus_corner_4_2",
        "studentName": "Robert Harris",
        "studentEmail": "robert.harris14@university.edu",
        "rating": 5,
        "text": "Nice ambiance.",
        "date": "12/14/2025",
        "time": "11:51 AM",
        "timestamp": "2025-12-14T06:21:48.193Z"
      },
      "rev_campus_corner_4_3": {
        "reviewId": "rev_campus_corner_4_3",
        "studentName": "Robert Smith",
        "studentEmail": "robert.smith27@university.edu",
        "rating": 3,
        "text": "Loved the food.",
        "date": "12/1/2025",
        "time": "01:42 AM",
        "timestamp": "2025-11-30T20:12:22.175Z"
      },
      "rev_campus_corner_4_4": {
        "reviewId": "rev_campus_corner_4_4",
        "studentName": "David Taylor",
        "studentEmail": "david.taylor12@university.edu",
        "rating": 3,
        "text": "Quick and easy.",
        "date": "12/16/2025",
        "time": "11:39 AM",
        "timestamp": "2025-12-16T06:09:15.169Z"
      },
      "rev_campus_corner_4_5": {
        "reviewId": "rev_campus_corner_4_5",
        "studentName": "William Lewis",
        "studentEmail": "william.lewis21@university.edu",
        "rating": 3,
        "text": "Could be cleaner.",
        "date": "12/26/2025",
        "time": "02:17 AM",
        "timestamp": "2025-12-25T20:47:52.812Z"
      },
      "rev_campus_corner_4_6": {
        "reviewId": "rev_campus_corner_4_6",
        "studentName": "Isabella Taylor",
        "studentEmail": "isabella.taylor7@university.edu",
        "rating": 5,
        "text": "Could be cleaner.",
        "date": "12/21/2025",
        "time": "03:45 AM",
        "timestamp": "2025-12-20T22:15:11.028Z"
      },
      "rev_campus_corner_4_7": {
        "reviewId": "rev_campus_corner_4_7",
        "studentName": "Isabella Smith",
        "studentEmail": "isabella.smith10@university.edu",
        "rating": 3,
        "text": "Great service!",
        "date": "12/23/2025",
        "time": "12:02 AM",
        "timestamp": "2025-12-22T18:32:46.998Z"
      },
      "rev_campus_corner_4_8": {
        "reviewId": "rev_campus_corner_4_8",
        "studentName": "David Wilson",
        "studentEmail": "david.wilson19@university.edu",
        "rating": 3,
        "text": "Tasty snacks.",
        "date": "12/25/2025",
        "time": "03:23 AM",
        "timestamp": "2025-12-24T21:53:18.956Z"
      },
      "rev_campus_corner_4_9": {
        "reviewId": "rev_campus_corner_4_9",
        "studentName": "Robert Harris",
        "studentEmail": "robert.harris14@university.edu",
        "rating": 4,
        "text": "Saved my assignment submission!",
        "date": "12/16/2025",
        "time": "02:10 AM",
        "timestamp": "2025-12-15T20:40:04.310Z"
      },
      "rev_campus_corner_4_10": {
        "reviewId": "rev_campus_corner_4_10",
        "studentName": "Isabella Taylor",
        "studentEmail": "isabella.taylor7@university.edu",
        "rating": 3,
        "text": "Great service!",
        "date": "12/25/2025",
        "time": "06:15 PM",
        "timestamp": "2025-12-25T12:45:57.551Z"
      },
      "rev_campus_corner_4_11": {
        "reviewId": "rev_campus_corner_4_11",
        "studentName": "William Lewis",
        "studentEmail": "william.lewis21@university.edu",
        "rating": 4,
        "text": "Quick and easy.",
        "date": "12/27/2025",
        "time": "02:10 AM",
        "timestamp": "2025-12-26T20:40:03.093Z"
      },
      "rev_campus_corner_4_12": {
        "reviewId": "rev_campus_corner_4_12",
        "studentName": "David Wilson",
        "studentEmail": "david.wilson19@university.edu",
        "rating": 3,
        "text": "Saved my assignment submission!",
        "date": "12/25/2025",
        "time": "07:35 PM",
        "timestamp": "2025-12-25T14:05:53.307Z"
      },
      "rev_campus_corner_4_13": {
        "reviewId": "rev_campus_corner_4_13",
        "studentName": "Thomas Day",
        "studentEmail": "thomas.day15@university.edu",
        "rating": 4,
        "text": "Could be cleaner.",
        "date": "12/17/2025",
        "time": "02:20 AM",
        "timestamp": "2025-12-16T20:50:45.584Z"
      },
      "rev_campus_corner_4_14": {
        "reviewId": "rev_campus_corner_4_14",
        "studentName": "Isabella Smith",
        "studentEmail": "isabella.smith30@university.edu",
        "rating": 4,
        "text": "A bit expensive but worth it.",
        "date": "12/4/2025",
        "time": "07:25 AM",
        "timestamp": "2025-12-04T01:55:31.999Z"
      },
      "rev_campus_corner_4_15": {
        "reviewId": "rev_campus_corner_4_15",
        "studentName": "Thomas Day",
        "studentEmail": "thomas.day15@university.edu",
        "rating": 5,
        "text": "Nice ambiance.",
        "date": "12/1/2025",
        "time": "08:40 PM",
        "timestamp": "2025-12-01T15:10:30.730Z"
      },
      "rev_campus_corner_4_16": {
        "reviewId": "rev_campus_corner_4_16",
        "studentName": "Robert Harris",
        "studentEmail": "robert.harris14@university.edu",
        "rating": 4,
        "text": "Best in campus.",
        "date": "12/26/2025",
        "time": "02:27 AM",
        "timestamp": "2025-12-25T20:57:49.623Z"
      },
      "rev_campus_corner_4_17": {
        "reviewId": "rev_campus_corner_4_17",
        "studentName": "James Connor",
        "studentEmail": "james.connor13@university.edu",
        "rating": 4,
        "text": "Very helpful staff.",
        "date": "12/9/2025",
        "time": "02:39 PM",
        "timestamp": "2025-12-09T09:09:40.462Z"
      },
      "rev_campus_corner_4_18": {
        "reviewId": "rev_campus_corner_4_18",
        "studentName": "Tom Connor",
        "studentEmail": "tom.connor2@university.edu",
        "rating": 3,
        "text": "Good quality products.",
        "date": "12/21/2025",
        "time": "01:08 PM",
        "timestamp": "2025-12-21T07:38:00.884Z"
      },
      "rev_campus_corner_4_19": {
        "reviewId": "rev_campus_corner_4_19",
        "studentName": "Mike Martinez",
        "studentEmail": "mike.martinez22@university.edu",
        "rating": 3,
        "text": "Saved my assignment submission!",
        "date": "12/18/2025",
        "time": "06:20 AM",
        "timestamp": "2025-12-18T00:50:44.166Z"
      }
    },
    "fast_corner_5": {
      "rev_fast_corner_5_0": {
        "reviewId": "rev_fast_corner_5_0",
        "studentName": "Daniel White",
        "studentEmail": "daniel.white9@university.edu",
        "rating": 4,
        "text": "Very helpful staff.",
        "date": "12/30/2025",
        "time": "02:49 AM",
        "timestamp": "2025-12-29T21:19:18.257Z"
      },
      "rev_fast_corner_5_1": {
        "reviewId": "rev_fast_corner_5_1",
        "studentName": "Jessica Walker",
        "studentEmail": "jessica.walker20@university.edu",
        "rating": 5,
        "text": "Could be cleaner.",
        "date": "12/28/2025",
        "time": "11:40 AM",
        "timestamp": "2025-12-28T06:10:31.522Z"
      },
      "rev_fast_corner_5_2": {
        "reviewId": "rev_fast_corner_5_2",
        "studentName": "Evelyn Clark",
        "studentEmail": "evelyn.clark18@university.edu",
        "rating": 5,
        "text": "Will come back again.",
        "date": "12/16/2025",
        "time": "11:13 PM",
        "timestamp": "2025-12-16T17:43:45.600Z"
      },
      "rev_fast_corner_5_3": {
        "reviewId": "rev_fast_corner_5_3",
        "studentName": "Alex White",
        "studentEmail": "alex.white16@university.edu",
        "rating": 3,
        "text": "Loved the food.",
        "date": "12/17/2025",
        "time": "09:48 PM",
        "timestamp": "2025-12-17T16:18:14.134Z"
      },
      "rev_fast_corner_5_4": {
        "reviewId": "rev_fast_corner_5_4",
        "studentName": "James Rodriguez",
        "studentEmail": "james.rodriguez26@university.edu",
        "rating": 5,
        "text": "Saved my assignment submission!",
        "date": "12/14/2025",
        "time": "01:21 AM",
        "timestamp": "2025-12-13T19:51:15.853Z"
      },
      "rev_fast_corner_5_5": {
        "reviewId": "rev_fast_corner_5_5",
        "studentName": "David Taylor",
        "studentEmail": "david.taylor12@university.edu",
        "rating": 4,
        "text": "Quick and easy.",
        "date": "12/16/2025",
        "time": "02:32 AM",
        "timestamp": "2025-12-15T21:02:18.253Z"
      },
      "rev_fast_corner_5_6": {
        "reviewId": "rev_fast_corner_5_6",
        "studentName": "Isabella Taylor",
        "studentEmail": "isabella.taylor7@university.edu",
        "rating": 3,
        "text": "Tasty snacks.",
        "date": "12/5/2025",
        "time": "07:02 AM",
        "timestamp": "2025-12-05T01:32:31.213Z"
      },
      "rev_fast_corner_5_7": {
        "reviewId": "rev_fast_corner_5_7",
        "studentName": "David Wilson",
        "studentEmail": "david.wilson19@university.edu",
        "rating": 5,
        "text": "A bit expensive but worth it.",
        "date": "12/10/2025",
        "time": "09:28 AM",
        "timestamp": "2025-12-10T03:58:34.428Z"
      },
      "rev_fast_corner_5_8": {
        "reviewId": "rev_fast_corner_5_8",
        "studentName": "Sophia Garcia",
        "studentEmail": "sophia.garcia17@university.edu",
        "rating": 3,
        "text": "Very helpful staff.",
        "date": "12/22/2025",
        "time": "10:42 PM",
        "timestamp": "2025-12-22T17:12:13.720Z"
      },
      "rev_fast_corner_5_9": {
        "reviewId": "rev_fast_corner_5_9",
        "studentName": "Evelyn Smith",
        "studentEmail": "evelyn.smith11@university.edu",
        "rating": 3,
        "text": "Will come back again.",
        "date": "12/15/2025",
        "time": "12:07 AM",
        "timestamp": "2025-12-14T18:37:14.152Z"
      },
      "rev_fast_corner_5_10": {
        "reviewId": "rev_fast_corner_5_10",
        "studentName": "Jessica Thompson",
        "studentEmail": "jessica.thompson28@university.edu",
        "rating": 5,
        "text": "Quick and easy.",
        "date": "12/14/2025",
        "time": "01:45 AM",
        "timestamp": "2025-12-13T20:15:58.647Z"
      },
      "rev_fast_corner_5_11": {
        "reviewId": "rev_fast_corner_5_11",
        "studentName": "Abigail Rodriguez",
        "studentEmail": "abigail.rodriguez24@university.edu",
        "rating": 4,
        "text": "Quick and easy.",
        "date": "12/27/2025",
        "time": "12:50 AM",
        "timestamp": "2025-12-26T19:20:12.492Z"
      },
      "rev_fast_corner_5_12": {
        "reviewId": "rev_fast_corner_5_12",
        "studentName": "Isabella Taylor",
        "studentEmail": "isabella.taylor7@university.edu",
        "rating": 5,
        "text": "A bit expensive but worth it.",
        "date": "12/14/2025",
        "time": "09:08 PM",
        "timestamp": "2025-12-14T15:38:51.897Z"
      },
      "rev_fast_corner_5_13": {
        "reviewId": "rev_fast_corner_5_13",
        "studentName": "Robert Smith",
        "studentEmail": "robert.smith27@university.edu",
        "rating": 5,
        "text": "Could be cleaner.",
        "date": "12/6/2025",
        "time": "06:26 PM",
        "timestamp": "2025-12-06T12:56:06.888Z"
      },
      "rev_fast_corner_5_14": {
        "reviewId": "rev_fast_corner_5_14",
        "studentName": "Jessica Jackson",
        "studentEmail": "jessica.jackson23@university.edu",
        "rating": 4,
        "text": "Average experience.",
        "date": "11/29/2025",
        "time": "02:15 PM",
        "timestamp": "2025-11-29T08:45:56.441Z"
      },
      "rev_fast_corner_5_15": {
        "reviewId": "rev_fast_corner_5_15",
        "studentName": "Isabella Smith",
        "studentEmail": "isabella.smith30@university.edu",
        "rating": 3,
        "text": "Quick and easy.",
        "date": "12/5/2025",
        "time": "01:04 AM",
        "timestamp": "2025-12-04T19:34:10.677Z"
      },
      "rev_fast_corner_5_16": {
        "reviewId": "rev_fast_corner_5_16",
        "studentName": "Rahul Sharma",
        "studentEmail": "rahul.sharma29@university.edu",
        "rating": 5,
        "text": "Could be cleaner.",
        "date": "12/7/2025",
        "time": "05:24 AM",
        "timestamp": "2025-12-06T23:54:59.259Z"
      },
      "rev_fast_corner_5_17": {
        "reviewId": "rev_fast_corner_5_17",
        "studentName": "Evelyn Clark",
        "studentEmail": "evelyn.clark18@university.edu",
        "rating": 4,
        "text": "Best in campus.",
        "date": "12/15/2025",
        "time": "02:16 AM",
        "timestamp": "2025-12-14T20:46:14.001Z"
      },
      "rev_fast_corner_5_18": {
        "reviewId": "rev_fast_corner_5_18",
        "studentName": "Emily Taylor",
        "studentEmail": "emily.taylor25@university.edu",
        "rating": 4,
        "text": "Good quality products.",
        "date": "12/7/2025",
        "time": "04:47 AM",
        "timestamp": "2025-12-06T23:17:16.465Z"
      },
      "rev_fast_corner_5_19": {
        "reviewId": "rev_fast_corner_5_19",
        "studentName": "William Lewis",
        "studentEmail": "william.lewis21@university.edu",
        "rating": 3,
        "text": "Nice ambiance.",
        "date": "12/5/2025",
        "time": "01:47 PM",
        "timestamp": "2025-12-05T08:17:10.049Z"
      }
    },
    "quick_hub_6": {
      "rev_quick_hub_6_0": {
        "reviewId": "rev_quick_hub_6_0",
        "studentName": "Charles Ross",
        "studentEmail": "charles.ross6@university.edu",
        "rating": 3,
        "text": "Will come back again.",
        "date": "12/1/2025",
        "time": "09:14 AM",
        "timestamp": "2025-12-01T03:44:42.078Z"
      },
      "rev_quick_hub_6_1": {
        "reviewId": "rev_quick_hub_6_1",
        "studentName": "Tom Walker",
        "studentEmail": "tom.walker4@university.edu",
        "rating": 4,
        "text": "A bit expensive but worth it.",
        "date": "12/2/2025",
        "time": "03:14 PM",
        "timestamp": "2025-12-02T09:44:49.103Z"
      },
      "rev_quick_hub_6_2": {
        "reviewId": "rev_quick_hub_6_2",
        "studentName": "Robert Harris",
        "studentEmail": "robert.harris14@university.edu",
        "rating": 5,
        "text": "Could be cleaner.",
        "date": "12/19/2025",
        "time": "04:31 AM",
        "timestamp": "2025-12-18T23:01:55.822Z"
      },
      "rev_quick_hub_6_3": {
        "reviewId": "rev_quick_hub_6_3",
        "studentName": "Thomas Day",
        "studentEmail": "thomas.day15@university.edu",
        "rating": 4,
        "text": "Great service!",
        "date": "12/24/2025",
        "time": "11:22 AM",
        "timestamp": "2025-12-24T05:52:32.081Z"
      },
      "rev_quick_hub_6_4": {
        "reviewId": "rev_quick_hub_6_4",
        "studentName": "Thomas Day",
        "studentEmail": "thomas.day15@university.edu",
        "rating": 5,
        "text": "Very helpful staff.",
        "date": "12/24/2025",
        "time": "03:29 AM",
        "timestamp": "2025-12-23T21:59:36.597Z"
      },
      "rev_quick_hub_6_5": {
        "reviewId": "rev_quick_hub_6_5",
        "studentName": "Evelyn Clark",
        "studentEmail": "evelyn.clark18@university.edu",
        "rating": 4,
        "text": "Tasty snacks.",
        "date": "12/10/2025",
        "time": "05:48 AM",
        "timestamp": "2025-12-10T00:18:53.791Z"
      },
      "rev_quick_hub_6_6": {
        "reviewId": "rev_quick_hub_6_6",
        "studentName": "Jessica Thompson",
        "studentEmail": "jessica.thompson28@university.edu",
        "rating": 4,
        "text": "Best in campus.",
        "date": "12/20/2025",
        "time": "01:19 AM",
        "timestamp": "2025-12-19T19:49:20.156Z"
      },
      "rev_quick_hub_6_7": {
        "reviewId": "rev_quick_hub_6_7",
        "studentName": "Isabella Rodriguez",
        "studentEmail": "isabella.rodriguez8@university.edu",
        "rating": 3,
        "text": "Friendly owner.",
        "date": "12/29/2025",
        "time": "03:06 AM",
        "timestamp": "2025-12-28T21:36:45.215Z"
      },
      "rev_quick_hub_6_8": {
        "reviewId": "rev_quick_hub_6_8",
        "studentName": "Alex White",
        "studentEmail": "alex.white16@university.edu",
        "rating": 4,
        "text": "Nice ambiance.",
        "date": "12/7/2025",
        "time": "03:27 AM",
        "timestamp": "2025-12-06T21:57:09.370Z"
      },
      "rev_quick_hub_6_9": {
        "reviewId": "rev_quick_hub_6_9",
        "studentName": "Rahul Sharma",
        "studentEmail": "rahul.sharma29@university.edu",
        "rating": 4,
        "text": "Average experience.",
        "date": "12/19/2025",
        "time": "12:46 AM",
        "timestamp": "2025-12-18T19:16:29.977Z"
      },
      "rev_quick_hub_6_10": {
        "reviewId": "rev_quick_hub_6_10",
        "studentName": "Thomas Day",
        "studentEmail": "thomas.day15@university.edu",
        "rating": 4,
        "text": "Very helpful staff.",
        "date": "12/23/2025",
        "time": "06:43 AM",
        "timestamp": "2025-12-23T01:13:14.264Z"
      },
      "rev_quick_hub_6_11": {
        "reviewId": "rev_quick_hub_6_11",
        "studentName": "Tom Connor",
        "studentEmail": "tom.connor2@university.edu",
        "rating": 5,
        "text": "A bit expensive but worth it.",
        "date": "12/11/2025",
        "time": "06:39 AM",
        "timestamp": "2025-12-11T01:09:10.117Z"
      },
      "rev_quick_hub_6_12": {
        "reviewId": "rev_quick_hub_6_12",
        "studentName": "Charles Ross",
        "studentEmail": "charles.ross6@university.edu",
        "rating": 3,
        "text": "Friendly owner.",
        "date": "12/24/2025",
        "time": "02:06 AM",
        "timestamp": "2025-12-23T20:36:39.568Z"
      },
      "rev_quick_hub_6_13": {
        "reviewId": "rev_quick_hub_6_13",
        "studentName": "Emily Taylor",
        "studentEmail": "emily.taylor25@university.edu",
        "rating": 4,
        "text": "Tasty snacks.",
        "date": "12/26/2025",
        "time": "01:29 AM",
        "timestamp": "2025-12-25T19:59:49.179Z"
      },
      "rev_quick_hub_6_14": {
        "reviewId": "rev_quick_hub_6_14",
        "studentName": "Thomas Day",
        "studentEmail": "thomas.day15@university.edu",
        "rating": 4,
        "text": "Highly recommended!",
        "date": "12/7/2025",
        "time": "09:41 AM",
        "timestamp": "2025-12-07T04:11:41.181Z"
      },
      "rev_quick_hub_6_15": {
        "reviewId": "rev_quick_hub_6_15",
        "studentName": "Mike Martinez",
        "studentEmail": "mike.martinez22@university.edu",
        "rating": 5,
        "text": "Quick and easy.",
        "date": "12/23/2025",
        "time": "09:26 PM",
        "timestamp": "2025-12-23T15:56:55.198Z"
      },
      "rev_quick_hub_6_16": {
        "reviewId": "rev_quick_hub_6_16",
        "studentName": "Rahul Sharma",
        "studentEmail": "rahul.sharma29@university.edu",
        "rating": 4,
        "text": "Best in campus.",
        "date": "12/6/2025",
        "time": "05:30 AM",
        "timestamp": "2025-12-06T00:00:44.089Z"
      },
      "rev_quick_hub_6_17": {
        "reviewId": "rev_quick_hub_6_17",
        "studentName": "Robert Smith",
        "studentEmail": "robert.smith27@university.edu",
        "rating": 3,
        "text": "Saved my assignment submission!",
        "date": "11/30/2025",
        "time": "05:39 PM",
        "timestamp": "2025-11-30T12:09:00.861Z"
      },
      "rev_quick_hub_6_18": {
        "reviewId": "rev_quick_hub_6_18",
        "studentName": "James Rodriguez",
        "studentEmail": "james.rodriguez26@university.edu",
        "rating": 3,
        "text": "Best in campus.",
        "date": "12/20/2025",
        "time": "10:41 PM",
        "timestamp": "2025-12-20T17:11:40.120Z"
      },
